1367	"<img src=""E9879C.png"" />"	cauldron			釜	かま	iron pot; kettle	cauldron, father, metal, gold	<i>Father</i> . . . <i>metal</i>. Note the stroke overlap between <i>father</i> and <i>metal</i>.		10	Your father uses his legs to stop himself from being put in a metal cauldron.	Whilst on holiday, my father was captured by cannibals and put in a metal cauldron.	釜	かま【釜】iron pot; kettle<br/>ちゃがま【茶釜】teakettle (tea ceremony)<br/>あとがま【後釜】successor; replacement / second wife<br/>どがま【土釜】earthen rice cooker<br/>かまめし【釜めし】rice, meat and vegetable dish served in a small pot<br/>かまめし【釜めし】rice, meat and vegetable dish served in a small pot<br/>おかま; オカマ【御竈】pot / volcanic crater / (one's) buttocks / male homosexual; effeminate man; male transvestite	34	フ	かま	2332	1476	0	[sound:RTK1_keyword_jp_1367..mp3]	[sound:RTK1_keyword_en_1367.mp3]
1368	"<img src=""E4BAA4.png"" />"	mingle			交じる	まじる　【交じる】	be mingled; be mixed	mingle, top hat, father	Top hat . . . father.		6	Even though your FATHER is an old man, he can´t give up his party lifestyle. Once a week he still dons his cool TOP HAT (well, it was cool 40 years ago) and goes out on the town to MINGLE with the ladies. This is a pretty common thing in Japan, where old motherfuckers still think they can pick up 19 year old girls.	Darth Vader tries to mingle with his troops. He even weares one of the helmets of the stromtroopers. (one of them laughs: white helmet, black suit. Darth Vader thereby slashes him in 2).	交	こうしょう【交渉】negotiations; discussions / connection<br/>こうかん【交換】exchange; interchange; switching; reciprocity; barter; substitution; replacement; clearing (of checks, cheques)<br/>かわす【交す】to exchange (messages, greetings, arguments, etc.) / to intersect; to cross; to interlace / ... with one another; ... to each other<br/>こうつう【交通】traffic; transportation; communication; exchange (of ideas, etc.); intercourse<br/>こうご【交互】mutual; reciprocal; alternate<br/>こうさい【交際】company; friendship; association; society; acquaintance<br/>こうたい【交代】alternation; change; relief; relay; shift; substitution (sports, etc.)<br/>がいこう【外交】diplomacy / selling (e.g. door-to-door); canvassing<br/>こうさ【交叉】crossing; intersection / (genetic) crossing over<br/>まじわる【交わる】to cross; to intersect; to join; to meet / to associate with; to mingle with; to consort with / to have a sexual relationship; to copulate<br/>こうたい【交代】alternation; change; relief; relay; shift; substitution (sports, etc.)<br/>まじえる【交える】to mix; to combine / to exchange (words, fire, etc.) / to cross (e.g. swords); to join together<br/>しゃこう【社交】social life; social intercourse<br/>こうさく【交錯】mixture; blending; complication; crossing; intersecting; interlacing<br/>こうしん【交信】telecommunications; correspondence<br/>こうせん【交戦】war; battle; hostilities<br/>せいこう【性交】sexual intercourse<br/>こうりゅう【交流】(cultural) exchange; interchange; interaction; (inter-) mingling; (social, etc.) networking; intercourse / alternating current; AC<br/>こうさてん【交叉点】crossing; intersection<br/>こうえき【交易】trade; commerce	34	コウ	まじ.わる, まじ.える, ま.じる, まじ.る, ま.ざる, ま.ぜる, -か.う, か.わす, かわ.す, こもごも	1275	128	2	[sound:RTK1_keyword_jp_1368..mp3]	[sound:RTK1_keyword_en_1368.mp3]
1369	"<img src=""E58AB9.png"" />"	merit			効く	きく	to be effective; to show effect / to do its work; to carry out its function well / to be possible to use	merit, mingle, top hat, father, power, muscle, arnold	<i>Mingle</i> . . . <i>power</i>. Note the distinct connotations that separate <b>merit</b> from <i>achievement</i> (Frame 927).		8	Mingling with the powerful can bring you success, bypassing the need for any merit.	There is great merit in mingling with the powerful.	効	こうか【効果】effect; effectiveness; efficacy; result / effects (e.g. sound effects, visual effects, special effects)<br/>きく【利く】to be effective; to show effect / to do its work; to carry out its function well / to be possible to use<br/>ゆうこう【有効】validity; legality; availability; effectiveness<br/>こうりつ【効率】efficiency; efficacy; performance; utility factor<br/>こう【効】efficacy; benefit; efficiency; effect; result; success<br/>かい【効】effect; result; worth; use; avail<br/>むこう【無効】invalid; no effect; unavailable; illegal<br/>こうりょく【効力】effect; efficacy; validity; potency<br/>ききめ【利目】effect; virtue; efficacy; impression<br/>こうのう; くのう【功能】effect; efficacy; virtue; benefit<br/>こうよう【効用】use; utility; effect; benefit<br/>とっこうやく【特効薬】specific medicine; wonder drug; silver bullet<br/>じこう【時効】statute of limitations; lapse of rights after a period of time; prescription (including acquisitive and extinctive prescription) / ageing; aging<br/>じっこう【実効】practical effect; efficacy; efficiency<br/>そっこう【即功】immediate effect; instant effect<br/>こうけん【効験】efficacy; effect<br/>ききめ【利目】effect; virtue; efficacy; impression<br/>やっこう【薬効】efficacy of a drug or medicine<br/>はっこう【発効】coming into effect<br/>しっこう【失効】lapse; abatement; invalidation	34	コウ	き.く, ききめ, なら.う	1276	697	2	[sound:RTK1_keyword_jp_1369..mp3]	[sound:RTK1_keyword_en_1369.mp3]
1370	"<img src=""E8BC83.png"" />"	contrast			比較的	ひかくてき	comparative; relative	contrast, car, mingle, top hat, father	Cars . . . mingle.		13	The people I had invited to the party were mingling quite well with one another, until they all suddenly started talking about the cars they own. Pretty soon the crowd divided itself into distinct, contrasting crowds: rich snobs with fancy cars, soccer moms with minivans, and hippies with bicycles.	Our world of today, cars mingling on busy streets, is in stark contrast to the one of yesteryear, where it was people who would mingle on the streets.	較	ひかく【比較】comparison<br/>ひかくてき【比較的】comparative; relative<br/>くらべる【比べる】to compare; to make a comparison / to compete; to vie<br/>こうせい【校正】proofreading; correction of press / calibration<br/>かくさ【較差】range	34	カク, コウ	くら.べる	1277	1811	2	[sound:RTK1_keyword_jp_1370..mp3]	[sound:RTK1_keyword_en_1370.mp3]
1371	"<img src=""E6A0A1.png"" />"	exam			学校	がっこう	school	exam, tree, wood, mingle, top hat, father	Tree . . . mingle.		10	With the exam scores posted on a TREE, the students MINGLED around looking at the results. test. 試.	Note: this Kanji does not mean exam. It means school. I find this keyword an choice odd as school by itself is not used elsewhere. Examples: 校長 is principal (lit. school chief); 中学校 is junior high school (lit. middle study/knowledge school).	校	こうこう【高校】senior high school; high school<br/>こうしゃ【校舎】school building<br/>こうちょう【校長】principal; headmaster<br/>しょうこう【将校】commissioned officer<br/>こうこうせい【高校生】senior high school student<br/>しょうがっこう【小学校】primary school; elementary school; grade school<br/>とうこう【登校】attendance (at school); going to school<br/>こうない【校内】within a school<br/>てんこう【転校】change schools<br/>こう【校】school / proof (of a book, document, etc.); counter for proofs<br/>こうもん【校門】school gate<br/>こうてい【校庭】schoolyard; campus<br/>ちゅうがっこう【中学校】junior high school; middle school; lower secondary school<br/>げこう【下校】coming home from school; end of school day<br/>じょがっこう【女学校】girl's school<br/>てんこうせい【転校生】transfer student; student changing schools<br/>よびこう【予備校】prep school (ronin year)<br/>ぜんこう【全校】the whole school<br/>こうせい【校正】proofreading; correction of press / calibration<br/>こうそく【校則】school regulations	34	コウ, キョウ		1278	23	4	[sound:RTK1_keyword_jp_1371..mp3]	[sound:RTK1_keyword_en_1371.mp3]
1372	"<img src=""E8B6B3.png"" />"	leg			足	あし	leg, foot	leg, mouth, mending, mend	<i>Mouth</i> . . . <i>mending</i>. Note that the last stroke of <i>mouth</i> and the first of <i>mending</i> overlap.	"* As a primitive on the left, it is amended to something similar to <i>correct</i> in place of <i>mending</i>. Its meaning remains <i>leg</i>, but should be thought of as a <i>wooden leg</i> in order to avoid confusion with other similar elements, namely <i>human legs</i>, <i>animal legs</i>, and <i>walking legs</i>.	 "	7	Captain Ahab lost his leg to the great white whale´s mouth and had to mend it with a peg leg.	I´ll use my mouth to mend your leg, I´ll kiss it all better :).	足	"まんぞく【満足】satisfaction; contentment; complacency / sufficient; enough; adequate; proper<br/>あしおと【足音】footsteps (sound)<br/>たりる【足りる】to be sufficient; to be enough / to be worth doing; to be worthy / to be sufficient; to answer; to do<br/>てあし【手足】one's hands and feet; limbs<br/>あしもと; そっか【足もと】at one's feet; underfoot; one's step (as in ""watch your step"") / gait; pace; step / most recent; current / you; thou<br/>あしもと; そっか【足もと】at one's feet; underfoot; one's step (as in ""watch your step"") / gait; pace; step / most recent; current / you; thou<br/>りょうそく; りょうあし; もろあし【両足】both feet / both legs<br/>ふそく【不足】insufficiency; shortage; deficiency; lack; dearth<br/>あしとり【足取り】downing an opponent by grabbing his leg<br/>あしどり【足どり】gait; walk; stride; pace; step; manner of walking / trace (e.g. of route taken by hunted criminal); track; trail; movements<br/>あしくび【足頸】ankle<br/>あしもと; そっか【足もと】at one's feet; underfoot; one's step (as in ""watch your step"") / gait; pace; step / most recent; current / you; thou<br/>あしあと; そくせき【足あと】footprints / record of page visitors (e.g. in social networking sites)<br/>たる【足る】to be sufficient; to be enough; to be worthy of<br/>あしば【足場】scaffold; scaffolding / foothold; footing / foothold (e.g. in business); foundation; base / convenience for transportation; convenience of access (by road or rail)<br/>みぎあし【右足】right foot / right leg<br/>かたあし【片脚】one leg; one-legged<br/>たす【足す】to add (numbers) / to add (something); to top up (with something) / to take care of (e.g. one's business)<br/>あしばや【足早】quick-footed; light-footed; quick pace<br/>ひとあし【一足】step / short distance; short time"	34	ソク	あし, た.りる, た.る, た.す	1279	54	4	[sound:RTK1_keyword_jp_1372..mp3]	[sound:RTK1_keyword_en_1372.mp3]
1373	"<img src=""E4BF83.png"" />"	stimulate			促す	うながす	to urge; to press; to prompt; to suggest; to demand; to stimulate; to quicken; to incite; to invite (attention to)	stimulate, person, leg, mouth, mending, mend	Person . . . leg.		9	Mr T, ever the optimist, is trying to stimulate Capt Ahab´s wooden leg by rubbing it down. Capt Ahab normally wouldn´t let anyone do that, but he appreciates Mr T´s stimulating conversation.	You stimulate a person by giving him a kick.	促	"うながす【促す】to urge; to press; to prompt; to suggest; to demand; to stimulate; to quicken; to incite; to invite (attention to)<br/>さいそく【催促】pressing; demanding; urging; demand; request; claim<br/>とくそく【督促】urge; demand; importunity<br/>そくしん【促進】promotion; acceleration; encouragement; facilitation; spurring on<br/>そくおん【促音】assimilated sound (small ""tsu"" in Japanese); geminate consonant<br/>そくせい【促成】promotion of growth<br/>はんそく【販促】sales promotion<br/>いざいそく【居催促】refusal to leave"	34	ソク	うなが.す	1280	1271	1	[sound:RTK1_keyword_jp_1373..mp3]	[sound:RTK1_keyword_en_1373.mp3]
1374	"<img src=""E68D89.png"" />"	nab			捉え所の無い	とらえどころのない	subtle; elusive; slippery	nab, finger, fingers, leg, mouth, mend	Fingers . . . leg.		10	I felt a finger on my leg as someone tried to nab my wallet.	Fingers nabs Davy Jone´s wooden leg: Argh! Bring me back me leg, ya scurvy dog!	捉	とらえる【捉える】to seize; to capture; to arrest / to grasp; to perceive; to treat (as)<br/>ほそく【捕そく】capture; seizure; prehension / apprehension; understanding<br/>はそく【把捉】grasping (a meaning)	34	ソク, サク	とら.える	2260	1397	0	[sound:RTK1_keyword_jp_1374..mp3]	[sound:RTK1_keyword_en_1374.mp3]
1375	"<img src=""E8B79D.png"" />"	long-distance			距離	きょり	distance; range	long-distance, wooden leg, mouth, stop, footprint, giant	Wooden leg . . . gigantic.		12	You can step a long-distance if you have a leg that´s gigantic!	You can step a long-distance if you have gigantic wooden legs (stilts).	距	きょり【距離】distance; range<br/>ちょうきょり【長距離】long distance; long haul<br/>きんきょり【近距離】short distance<br/>たんきょり【短距離】short distance; short range; short-haul<br/>えんきょり【遠距離】long distance; tele-<br/>とうきょり【等距離】equidistant<br/>ちゅうきょり【中距離】middle-distance (races)	34	キョ	へだ.たる, けづめ	1281	1704	1	[sound:RTK1_keyword_jp_1375..mp3]	[sound:RTK1_keyword_en_1375.mp3]
1376	"<img src=""E8B7AF.png"" />"	path			通路	つうろ	pathway, aisle	path, wooden leg, mouth, stop, footprint, each, walking legs, mouth, mouth2	Wooden leg . . . each.		13	When pirates try to hide, it´s always easy to find them. Their wooden legs leave distinctive prints, showing where each is hiding and the exact path he took.	I have a wooden leg for each type of path. One with a rubber stopper at the end for absorbing shocks on paved paths, and one with a wide foot to distribute weight better on mud paths.	路	"みち【径】road; street; way; path; course; route; lane / distance; ways (e.g. ""a long ways"") / the way (of proper conduct, etc.); one's way; morals / teachings (esp. Confucian or Buddhist); dogma / field (of medicine, etc.); subject / way; method; means<br/>ち; ぢ【路】way; road / way to ...; road to ...<br/>じ【路】route; road / distance travelled in a day / (with decade) one's ....; age ....<br/>つうろ【通路】passage; pathway; roadway; avenue; aisle<br/>どうろ【道路】road; highway<br/>ろじ【路地】alley; alleyway; lane / bare earth (i.e. ground not covered by a roof); open field; outdoors (non-greenhouse cultivation of crops) / teahouse garden / path through a gate (or through a garden, etc.)<br/>かいろ【回路】circuit (electric) / cycle (e.g. Krebs cycle)<br/>めいろ【迷路】maze; labyrinth; blind alley<br/>しんろ【進路】route; course / career, university choices; course (of future life)<br/>ろじょう【路上】(on the) road; (on the) way<br/>がいろ【街路】road; street; avenue<br/>こうろ【航路】course; (sea) route; run<br/>せんろ【線路】railway track; railway line; railroad; railway; track; line<br/>しんろ【針路】course; direction; compass bearing<br/>こうじ; しょうじ【小路】lane; alley<br/>こみち; しょうけい【小径】path; lane / small diameter; small radius<br/>すいろ【水路】waterway; canal; channel / aqueduct; conduit<br/>ろめん【路面】road surface<br/>けいろ【径路】course; route; path; channel / process; means<br/>ろせん【路線】route; line; alignment"	34	ロ, ル	-じ, みち	1282	439	2	[sound:RTK1_keyword_jp_1376..mp3]	[sound:RTK1_keyword_en_1376.mp3]
1377	"<img src=""E99CB2.png"" />"	dew			露	つゆ	dew, dewfall	dew, rain, weather, path, wooden leg, mouth, stop, footprint, each, walking legs, mouth, mouth2	Rain . . . path.		21	After the rain the path was covered with dew.	Dew forms on the path least weathered.	露	あらわ【露】exposed; scanty; bare; unconcealed; naked / public; open<br/>ロ; ろ【露】Russia<br/>つゆ【露】dew / tears / (not) a bit; (not) at all<br/>ろしゅつ【露出】exposure; disclosure / photographic exposure<br/>ろこつ【露骨】frank; blunt; plain; outspoken / conspicuous; open / broad; suggestive; lewd<br/>ひろう【披露】announcement; presentation; demonstration; displaying; showing; introducing; exhibiting; unveiling; revealing; showcasing; performing; giving a rendition<br/>ろてん【露店】street stall; stand; booth<br/>ろだい【露台】balcony<br/>ばくろ【暴露】disclosure; exposure; revelation<br/>ロシア; ロシヤ【露西亜】Russia<br/>ろてい【露呈】exposure; disclosure<br/>ろけん【露見】discovery; detection; exposure<br/>よつゆ; やろ【夜露】evening dew; night dew<br/>とろ【吐露】express one's mind; speak out<br/>ろてん【露天】open air<br/>ろてんぶろ【露天風呂】open air bath; rotemburo<br/>はつろ【発露】appearance; expression; manifestation<br/>かんろ【甘露】nectar; sweetness<br/>ろけん【露見】discovery; detection; exposure<br/>ひろうえん【披露宴】reception (wedding)	34	ロ, ロウ	つゆ	1283	2128	1	[sound:RTK1_keyword_jp_1377..mp3]	[sound:RTK1_keyword_en_1377.mp3]
1378	"<img src=""E8B7B3.png"" />"	hop			跳ねる	はねる　【跳ねる】	bound; hop; leap	hop, wooden leg, mouth, stop, footprint, portent, omen	Wooden leg . . . portent.		13	A girl with a wooden leg always wanted to play hopscotch with the other girls, but every time she tried to hop she´d lose her balance and injure another girl. That´s why the other girls make fun of her and see her presence as a portent to injury.	A turtle with a wooden leg needs to hop to get around.	跳	はねる【跳ねる】to jump; to leap; to prance; to spring up; to bound; to hop / to break up; to close; to come to an end / to hit (e.g. to have a car hit something or someone)<br/>とぶ【翔ぶ】to fly; to soar / to jump; to leap; to spring; to bound; to hop<br/>ちょうやく【跳躍】jump; leap; skip; bound<br/>はねあがる【はね上がる】to jump up; to spring up / to jump (market, price, etc.); to rise sharply; to skyrocket / to act rashly; to jump the gun<br/>ちょうりょう【跳梁】jumping about; rampancy; domination<br/>はねかえる【跳ね返る】to rebound; to recoil; to spring back up; to bounce back / to splash / to have a repercussion; to have a reciprocal effect<br/>とびはねる【跳びはねる】to jump up and down; to hop<br/>はねかえす【撥ね返す】to reject; to repulse; to repel / to bounce back; to counterattack; to strike back<br/>はね【撥ね】(a) jump / splashes (usu. of mud) / upward turn at the bottom (e.g. of a vertical stroke of a kanji or of a hairdo) / close (e.g. of a theatrical performance); breakup<br/>はねばし【跳ね橋】drawbridge<br/>とびばこ【とび箱】vaulting horse; vaulting box; box horse<br/>とびつく【跳びつく】to jump at; to be attracted by<br/>はねのける【撥ね退ける】to push aside; to brush or thrust aside; to remove; to get rid of<br/>なわとび【縄跳び】skipping rope; jump rope / skipping; rope-jumping<br/>とびこす【跳び越す】to leap over<br/>とびばこ【とび箱】vaulting horse; vaulting box; box horse<br/>さんだんとび【三段跳】triple jump; hop, step and jump<br/>はねだす【跳ね出す】to spring or rush out<br/>はしりたかとび【走り高跳び】running high jump<br/>はねのける【撥ね退ける】to push aside; to brush or thrust aside; to remove; to get rid of	34	チョウ	は.ねる, と.ぶ, -と.び	1284	1810	1	[sound:RTK1_keyword_jp_1378..mp3]	[sound:RTK1_keyword_en_1378.mp3]
1379	"<img src=""E8BA8D.png"" />"	leap			飛躍	ひやく　【飛躍】	jump; leap	leap, wooden leg, mouth, stop, footprint, futon, feathers, wings, turkey	Wooden leg . . . feathers . . . turkey.		21	Well, there are weekdays weekday (#576) and there are laundry days laundry (#577), and on February 29th leap day, the manufacturer recommends servicing or replacing your peg leg because they tend to wear out every 4 years.	[Story for people following katsuo in making feathers+turkey a ´futon´ primitive] If you´re going to leap from a high place, better hope there´s a futon below -- otherwise you´re going to break your leg at the very least...	躍	おどる【跳る】to jump; to leap / to pound (of one's heart, i.e. with excitement); to throb / to be messily written<br/>ちょうやく【跳躍】jump; leap; skip; bound<br/>かつやく【活躍】activity (esp. energetic); great efforts; conspicuous service / to flourish; to participate actively; to play an active role<br/>ひやく【飛躍】leaping; activity / leapfrog (over a problem); making a leap (e.g. in logic) / making great strides; making rapid progress / emerging / becoming active; playing an active part<br/>やくどう【躍動】lively motion; throb<br/>やっき【躍起】desperation; eagerness<br/>あんやく【暗躍】secret manoeuvering; secret maneuvering; secret manoeuvres; secret maneuvers<br/>おどりでる【おどり出る】to jump (e.g. to first place); to spring out<br/>いちやく【一躍】suddenly (rising to fame, etc.); instantly; immediately; overnight / one bound; one leap<br/>こおどり【小踊り】dancing or jumping for joy<br/>ゆうやく【勇躍】taking heart; being in high spirits<br/>おどりあがる【おどり上がる】to spring up; to leap to one's feet; to jump up and down<br/>おどりこむ【躍り込む】to jump into; to rush into<br/>じゃくやく【雀躍】leaping for joy; exultation<br/>やくじょ【躍如】vivid; lifelike; graphic<br/>やくしん【躍進】making rapid progress; making great advances; rush; dash; onslaught<br/>あんちゅうひやく【暗中飛躍】behind-the-scenes maneuvering; behind-the-scenes manoeuvering; secret maneuvers; secret manoeuvres<br/>きんきじゃくやく【欣喜雀躍】jump up for joy	34	ヤク	おど.る	1285	2127	1	[sound:RTK1_keyword_jp_1379..mp3]	[sound:RTK1_keyword_en_1379.mp3]
1380	"<img src=""E8B7B5.png"" />"	tread			実践	じっせん	practice; practising; putting into practice; implementation	tread, wooden leg, mouth, stop, footprint, parade float	Wooden leg . . . parade float.		13	The pirate with the wooden leg chased after the parade float and was run over by the next one, leaving tread marks all over him and his leg.	Pirates must tread carefully when walking on parade floats, so as not to break through the weak plaster with their wooden legs.	践	じっせん【実践】practice; practising; putting into practice; implementation<br/>せんそ【践祚】accession (to the throne)	34	セン	ふ.む	1286	1809	1	[sound:RTK1_keyword_jp_1380..mp3]	[sound:RTK1_keyword_en_1380.mp3]
