1436	"<img src=""E7B8A6.png"" />"	vertical			縦	たて	lengthways, vertical	vertical, thread, spiderman, accompany, Nelson, column, going, line, horns, mend	Thread . . . accompany.		16	When Spider-man does his amazing vertical wall climbing, a throng of photographers accompanies him to get a good shot of the action.	True vertical can be found by hanging a plumb line - a thread accompanied by a weight.	縦	そうじゅう【操縦】steering; piloting; flying; control; operation; handling / management; handling; control; manipulation<br/>たて【竪】the vertical; height / front-to-back; length / north-to-south / vertical (relationship); hierarchy / (weaving) warp<br/>ほしいまま【恣】selfish; self-indulgent; arbitrary<br/>よし【縦】even if<br/>じゅうおう; たてよこ【縦横】length and width; length and breadth; lengthwise and crosswise; longitude and latitude; vertical and horizontal / four cardinal points; every direction / as one wishes; as one pleases; at will / warp and weft; warp and woof<br/>たてなが【縦長】oblong; vertical writing style (e.g. on envelopes); portrait orientation<br/>じゅうおうむじん【縦横無尽】freely; right and left; as one pleases<br/>たてあな【たて穴】pit; shaft<br/>じゅうだん【縦断】flying through; cutting across; longitudinal slice<br/>たてじま【立縞】vertical stripes; striped fabric<br/>じゅうたい【縦隊】column<br/>よし【縦】even if<br/>ほうじゅう; ほうしょう【放縦】self-indulgence; looseness; dissolution; licence; license<br/>じゅうれつ【縦列】column; file<br/>たていと【たて糸】(weaving) warp<br/>じゅうかん【縦貫】running through; traversal<br/>じゅうそう【縦走】traverse; walk along the ridge<br/>たとえ; たとい【仮令】even if; no matter (what); if; though; although; supposing; supposing that; -ever<br/>じゅうじん【縦陣】column<br/>じゅうらん【縦覧】inspection	36	ジュウ	たて	1338	903	1	[sound:RTK1_keyword_jp_1436..mp3]	[sound:RTK1_keyword_en_1436.mp3]
1437	"<img src=""E7B7BB.png"" />"	fine			緻密	ちみつ	minute; fine; delicate; accurate; precise; elaborate		The key word should be taken to mean minute, detailed, or nuanced. Its primitive elements are: <i>thread</i> . . . <i>doth</i>.		15			緻	せいち【精緻】delicate; minute; subtle<br/>ちみつ【緻密】minute; fine; delicate; accurate; precise; elaborate<br/>こうち【巧緻】elaborate; exquisite; detailed<br/>さいち【細緻】minute; meticulous	36	チ	こまか.い		2012	0	[sound:RTK1_keyword_jp_1437..mp3]	[sound:RTK1_keyword_en_1437.mp3]
1438	"<img src=""E7B79A.png"" />"	line			線	せん	line	line, thread, spiderman, spring, white, dove, water	Thread . . . spring.		15	This kanji is used for train lines. Spiderman does a hot spring tour of Japan using the train lines. You can see the Spidey costume hanging on the washing line as he enjoys the onsen.	Japan´s train lines are like threads that spring from Tokyo station.	線	せん【線】line; stripe; stria / line (e.g. telephone line); wire / ray (e.g. X-ray); beam / line (e.g. of a railroad); track; route; lane / outline; contours; form / level / division / line (of action); position; approach; policy; principle / impression one leaves; air one gives off<br/>むせん【無線】wireless; radio<br/>こうせん【光線】beam; light ray<br/>いっちょくせん【一直線】straight line<br/>ちょくせん【直線】straight line<br/>ぜんせん【前線】(weather) front / front line; forward area; action zone<br/>めせん【目線】one's gaze / point of view; standpoint<br/>きょくせん【曲線】curve<br/>ちへいせん【地平線】horizon (related to land)<br/>せんせん【戦線】(war) front<br/>せんろ【線路】railway track; railway line; railroad; railway; track; line<br/>かいせん【回線】circuit; line<br/>せきがいせん【赤外線】infrared rays<br/>かせん【火線】firing line<br/>しゃみせん; さみせん【三味線】shamisen; samisen; three-stringed Japanese lute<br/>いっせん【一線】line<br/>ねっせん【熱線】heat ray; line of heat<br/>せんこう【線香】incense stick<br/>りょうせん【稜線】ridgeline; lines of a mountain ridge<br/>ろせん【路線】route; line; alignment	36	セン	すじ	1339	176	2	[sound:RTK1_keyword_jp_1438..mp3]	[sound:RTK1_keyword_en_1438.mp3]
1439	"<img src=""E7B6BB.png"" />"	come apart at the seams			綻びる	ほころびる	to come apart at the seams; to be ripped; to be torn	come apart at the seams, thread, spiderman, determine, determined, house, mend	Thread . . . determine.		14	Even though his costume is coming apart at the seams as he chases the bad guys, Spiderman is still determined to catch them.	Spiderman´s costume has come apart at the seams and here he is, mending it in his house, determined to make it stronger than before.	綻	はたん【破たん】failure; bankruptcy<br/>ほころぶ【綻ぶ】to begin to open; to come out / to smile broadly / to come apart at the seams (clothes)<br/>ほころびる【綻びる】to come apart at the seams; to be ripped; to be torn / to begin to open; to begin to bloom / to smile broadly; to break into a smile<br/>ほころばす【綻ばす】to rip up (a seam); to burst; to tear; to break out (e.g. into a smile)	36	タン	ほころ.びる	2670	1867	0	[sound:RTK1_keyword_jp_1439..mp3]	[sound:RTK1_keyword_en_1439.mp3]
1440	"<img src=""E7B7A0.png"" />"	tighten			締める	しめる	tighten, fasten	tighten, thread, spiderman, sovereign, vase, stand up, apron, crown, towel	Thread . . . sovereign.		15	(astridtops) Spiderman managed to get behind the sovereign. (pick your favourite nowadays country ruler who isn´t doing a good job). Spidey has tightend a web around the sovereing´s throat. As long as the sovereign says what spidey whispers, he will be fine. Sovereign yelping : ´ we will draw are troops back! and we will spend more money on healthcare, schools and less on wars!´ Spidey whispering: ´ If you continue at this pace, you might be doing good things AND the people will like you.´.	The sovereign appears to be ruling, but in reality someone behind him (for instance his wife) has a thread around his throat, and if he dares to make a decision she doesn´t like, she starts pulling the thread and tightens it around his throat.	締	しめる【締める】to tie; to fasten / to total; to sum / to be strict with / to economize; to economise; to cut down on / to salt; to marinate; to pickle; to make sushi adding a mixture of vinegar and salt / to wear (necktie); to put on (necktie)<br/>しめつける【締めつける】to tighten; to press hard<br/>にぎりしめる【握りしめる】to grasp tightly<br/>しまる【緊まる】to be shut; to close; to be closed / to be firm (of a body, face, etc.); to be well-knit / to be locked / to tighten; to be tightened / to become sober; to become tense<br/>ひきしめる【引きしめる】to tighten; to stiffen; to brace; to strain<br/>ひきしまる【引きしまる】to become tense; to be tightened<br/>だきしめる【抱きしめる】to hug someone close; to hold someone tight; to embrace closely<br/>しめつける【締めつける】to tighten; to press hard<br/>かみしめる【噛しめる】to chew thoroughly; to bite (e.g. one's lip) / to reflect upon; to digest<br/>しめつけ【締めつけ】pressure; clamping; tightening; fastening<br/>しめ【〆】tie up; bind; fastening; tightening / sum; total amount; total / judo choking (strangling) techniques / last meal eaten when going restaurant hopping / completion; conclusion; rounding off / counter for bundles; counter for faggots; counter for bundles of 2000 sheets of paper / end mark; closure mark<br/>とじまり【戸締り】closing up; fastening the doors<br/>とりしまり【取締】control; management; supervision<br/>とじまり【戸締り】closing up; fastening the doors<br/>しめて【締めて】in all; all told<br/>とりしまり【取締】control; management; supervision<br/>しめくくる【締めくくる】to bring to a finish / to bind firmly / to superintend<br/>はがいじめ【羽交い絞め】pinioning; binding arms behind the back<br/>しめきる【〆切る】to close up; to shut up (e.g. behind doors); to cut off (e.g. because a deadline has expired)<br/>しめきり【乄切り】deadline; closing; cut-off; end / cofferdam / closed (door, window, etc.)	36	テイ	し.まる, し.まり, し.める, -し.め, -じ.め	1340	1951	1	[sound:RTK1_keyword_jp_1440..mp3]	[sound:RTK1_keyword_en_1440.mp3]
1441	"<img src=""E7B6AD.png"" />"	fiber			繊維	せんい　【繊維】	fiber; textile	fiber, thread, spiderman, turkey	Thread . . . turkey.		14	Hey, Spidey! Eat that turkey if you want, but make sure you eat some fibers: you want spidey threads, don´t ya?	If you want to increase your fiber intake, just leave on those threads that are used to sew up the stuffed turkey and eat them too.	維	いじ【維持】maintenance; preservation; improvement<br/>せんい【線維】fibre; fiber; textile<br/>いしん【維新】reformation; revolution; renewal / Meiji Restoration<br/>めいじいしん【明治維新】Meiji Restoration<br/>きんせんい【筋線維】muscle fiber; muscle fibre<br/>せんい【線維】fibre; fiber; textile<br/>せんいそ【線維素】cellulose / fibrin	36	イ		1341	1868	1	[sound:RTK1_keyword_jp_1441..mp3]	[sound:RTK1_keyword_en_1441.mp3]
1442	"<img src=""E7BE85.png"" />"	gauze			甲羅	こうら	shell; carapace	gauze, eye, cross-eyed, net, fibre, thread, spiderman, turkey	Eye . . . fiber.		19	Lots of girls in Japan wear gauze patches over one eye made of course white fibers. They think it is cute, and I must admit, I have come to think so too.	"Rocky won the match but left with a nasty eye injury, and needs some gauze for it. I use a modified version of the Rocky theme song to remember this one -- ""the eye and the fiber""."	羅	うすもの; ら【羅】lightweight fabric or clothing; silk gauze; thin silk / Latin (language)<br/>しゅら【修羅】fighting; scene of carnage<br/>しゅらば; しゅらじょう【修羅場】fighting scene; scene of carnage (bloodshed) / location of the fight between Asura and Sakra devanam Indra / difficulties (in a love relationship) / crunch time (esp. for cartoonists)<br/>こうら【甲羅】shell; carapace<br/>られつ【羅列】enumeration; citation; listing<br/>らしゃ; ラシャ【羅紗】felt; woollen cloth<br/>てんぷら; テンプラ【天ぷら】tempura; deep-fried fish and vegetables in a light batter<br/>らかん【羅漢】arhat; Lohan; achiever of Nirvana<br/>しんらばんしょう【森羅万象】all things in nature; the whole creation<br/>らしんばん【羅針盤】compass<br/>ラオス【羅宇】Laos<br/>らう; らお【羅宇】bamboo pipestem<br/>きら【綺羅】fine clothes<br/>いっちょうら【一帳羅】one's (only) good suit (or kimono)<br/>もうら【網羅】comprising; including; covering; encompassing; comprehending<br/>あしゅら【阿修羅】Asura (fighting demon)<br/>きゃら【伽羅】aloes wood; Taxus cuspidata var. nana / aloes-wood perfume<br/>まんだら【曼荼羅】mandala; Buddhist visual schema of the enlightened mind<br/>らしんぎ【羅針儀】compass<br/>らせつ【羅刹】rakshasa (type of evil spirit)	36	ラ	うすもの	1342	2103	1	[sound:RTK1_keyword_jp_1442..mp3]	[sound:RTK1_keyword_en_1442.mp3]
1443	"<img src=""E7B7B4.png"" />"	practice			練習	れんしゅう	practice, training	practice, thread, spiderman, east, tree, wood, sun, day	Thread . . . east.		14	Spidey stays on the east side of the city to practice. The West Side is too dangerous.	[+ skinnyneo] Spiderman visits the East to practice his swinging skills. All those Asian cities with skyscrapers and low crime rates make it easy for him to practice.	練	くんれん【訓練】practice; practising; training<br/>れんしゅう【練習】practice; practising<br/>みれん【未練】lingering affection; attachment; regret; regrets; reluctance; ruefulness<br/>しれん【試煉】test; trial; probation; ordeal; tribulation<br/>ねる【煉る】to knead; to thicken into a paste (stirring over a flame) / to polish (a plan, etc.); to refine; to elaborate; to work out / to train; to drill; to exercise / to gloss (silk); to soften; to degum / to tan (leather) / to temper (steel) / to walk in procession; to parade; to march<br/>じゅくれん【熟練】skill; dexterity; proficiency<br/>しゅうれん【修煉】training; drill; practice; practising; discipline<br/>せんれん【洗煉】polish; refinement<br/>しゅれん; てだれ【手練】skill; dexterity; master hand<br/>てれん【手練】means of deceiving another<br/>みれんがましい【未練がましい】regretful; irresolute / stubborn (not knowing when to give up)<br/>たんれん【鍛練】tempering; forging; hardening; disciplining; training<br/>ねりあるく【ねり歩く】to parade; to march<br/>れんぺい【練兵】military drill<br/>ろうれん【老練】experienced; veteran<br/>あされん【朝練】morning training (e.g. before school)<br/>ねれる【煉れる】to be well-kneaded / to be seasoned; to be experienced; to be mature and well-rounded<br/>れんたつ【練達】expert(ise); skill; dexterity<br/>きょうれん【教練】drill<br/>しゅうれん【習練】practice; practising; training; discipline	36	レン	ね.る, ね.り	1343	438	2	[sound:RTK1_keyword_jp_1443..mp3]	[sound:RTK1_keyword_en_1443.mp3]
1444	"<img src=""E7B792.png"" />"	thong			緒	お	cord; strap; thong / string (of a musical instrument, bow, etc.)	thong, thread, spiderman, someone, puppet, sooty, old man, sun, day	<i>Thread</i> . . . <i>puppet</i>. Although we usually think of a <b>thong</b> as coming at the end of a piece of string, this character´s meaning allows for it to come at the beginning as well.		14	Spiderman has a secret fetish, he likes nothing better than to dress his lovedoll in a thong. Wierd, eh!	"Instead of puppet I like to think of ""someone"" as ninja (since it is the second kanji in ninja). A ninja must be able to steal a thread from a woman´s thong without her noticing."	緒	しょ; ちょ【緒】beginning; inception<br/>いとぐち【糸口】thread end / beginning / clue<br/>お【緒】cord; strap; thong / string (of a musical instrument, bow, etc.)<br/>ないしょ; ないしょう【内所】secrecy; confidentiality; privacy; secret / one's circumstances (esp. fiscal) / inner realization; personal enlightenment / kitchen<br/>じょうちょ; じょうしょ【情緒】emotion; feeling / atmosphere; mood; spirit<br/>ゆいしょ【由緒】history; pedigree; lineage<br/>はなお【鼻緒】sandal strap; geta strap<br/>たんしょ; たんちょ【端緒】a clue; start; beginning<br/>しょせん; ちょせん【緒戦】beginning of hostilities; beginning of competition<br/>いっしょくた【一緒くた】jumbled together; lumped together / medley; hodgepodge; potpourri; heterogenous mixture<br/>さげお【下緒】cord for attaching a sword scabbard tightly to the obi; sword strap; sword knot<br/>へそのお【へその緒】umbilical cord<br/>しょげん; ちょげん【緒言】foreword; preface<br/>しょろん; ちょろん【緒論】introduction; preface<br/>へそのお【へその緒】umbilical cord<br/>しんしょ; しんちょ【心緒】emotion; mind<br/>おじめ【緒締め】string-fastener; drawstring on pouch or purse (handbag)	36	ショ, チョ	お, いとぐち	1344	1870	2	[sound:RTK1_keyword_jp_1444..mp3]	[sound:RTK1_keyword_en_1444.mp3]
1445	"<img src=""E7B69A.png"" />"	continue			続く	つづく	continue, follow	continue, thread, spiderman, sell, samurai, crown, human legs	Thread . . . sell.		13	Even though Peter Parker has become Spiderman, he continues to sell pictures that he takes as a photographer.	"Here´s how Spiderman comics sell: At the end of the comic they leave with with a cliffhanger and say ""to be continued"". In fact, the japanese verb 続く is used in comics and tv shows to mean ""to be continued"". They have adapted the model created by Spiderman to hook the readers so that they can sell more comics."	続	れんぞく【連続】serial; consecutive; continuity; occurring in succession; continuing<br/>てつづき【手続】procedure; (legal) process; formalities<br/>せつぞく【接続】connection; attachment; union; join; joint; link / changing trains / conjunction<br/>つづき【続き】sequel; continuation; (also suffix) continuation (in time and space); second series; succession; spell<br/>こうぞく【後続】succeeding; following; trailing<br/>けいぞく【継続】continuation<br/>そうぞく【相続】succession; inheritance<br/>じぞく【持続】continuation; persisting; lasting; sustaining; enduring<br/>だんぞく【断続】intermittent<br/>ぞっこう【続行】continuation; continuance; going on; resuming<br/>たてつづけ【立てつづけ】succession; continuation; series; sequence<br/>そんぞく【存続】duration; continuance<br/>ぞくぞく【続々】successively; one after another<br/>つづけざま【続けざま】one after another<br/>ぞく; しょく【続】continuation; sequel<br/>ひきつづき【引き続き】continuously; continually; without a break / next; then; after that<br/>ぞくしゅつ【続出】appearance one after another<br/>ながつづき【永続き】permanence; continuation; long-lasting / to last a long time; to continue; to keep at something for a long time<br/>ひきつづく【引き続く】to continue (for a long time); to occur in succession<br/>こうぞく【航続】cruising; flight	36	ゾク, ショク, コウ, キョウ	つづ.く, つづ.ける, つぐ.ない	1345	563	2	[sound:RTK1_keyword_jp_1445..mp3]	[sound:RTK1_keyword_en_1445.mp3]
1446	"<img src=""E7B5B5.png"" />"	picture			絵	え	picture, painting	picture, thread, spiderman, meeting, one, wall, umbrella, rising cloud, two, elbow, wall	Thread . . . meeting.		12	There´s never a picture of Spiderman meeting Peter Parker... I wonder why?	"Peter Parker´s editor tells him ""Next time you have a meeting with spiderman take a goddamn picture, you´re a photographer after all""."	絵	え【絵】picture; drawing; painting; sketch<br/>さしえ【挿絵】illustration (e.g. book); picture<br/>かいが【絵画】picture; painting<br/>えかき【絵かき】painter; artist / drawing pictures; doodling; painting<br/>あぶらえ【油絵】oil painting<br/>えのぐ【絵具】paint; coloring materials; colors; colours<br/>えほん【絵本】picture book<br/>えま; えうま【絵馬】votive picture (originally of horse)<br/>えのぐ【絵具】paint; coloring materials; colors; colours<br/>えはがき【絵はがき】picture postcard<br/>かげえ【影画】shadow picture; silhouette; shadowgraph<br/>えず【絵図】illustration; drawing<br/>くちえ【口絵】frontispiece<br/>えふで【絵筆】paintbrush<br/>えし; がし【画師】painter; artist; painter supported by patron<br/>さしえ【挿絵】illustration (e.g. book); picture<br/>まきえ【蒔絵】gold or silver lacquer; lacquer decoration sprinkled with metal powder<br/>にしきえ【錦絵】colour (woodblock) print; color print<br/>うきよえ【浮世絵】ukiyoe (color print of everyday life in the Edo period) (colour)<br/>にがおえ【似顔画】portrait; likeness	36	カイ, エ		1346	95	2	[sound:RTK1_keyword_jp_1446..mp3]	[sound:RTK1_keyword_en_1446.mp3]
1447	"<img src=""E7B5B1.png"" />"	overall			大統領	だいとうりょう	president; chief executive	overall, thread, spiderman, allot, infant, toddler, top hat, elbow, human legs	Thread . . . allot.		12	Spidey is alloted the biggest crime fighter jurisdiction in NYC because his OVERALL arrest record is the best.	According to Greek mythology, there´s a thread alloted to everyone, and its length is the overall determinant of your fate.	統	とういつ【統一】unity; consolidation; uniformity; unification; compatible<br/>けいとう【系統】system / lineage; ancestry; family line / group (e.g. of colors) (colours); family (e.g. of languages); party; school (of thought) / close (evolutionary) relationship / a population sharing a common ancestor (in genetics); strain (e.g. bacterial)<br/>でんとう【伝統】tradition; convention<br/>だいとうりょう【大統領】president; chief executive<br/>とうち; とうじ【統治】rule; reign; government; governing<br/>とうごう【統合】integration; unification; synthesis / integrated; built-in<br/>とうけい【統計】statistics<br/>とうせい【統制】regulation; control<br/>せいとう; しょうとう【正統】legitimate; orthodox; traditional<br/>いっとう【一統】lineage; line; unification; all (of you)<br/>けっとう【血統】lineage; pedigree; family line; birth<br/>とうそつ【統率】command; lead; generalship; leadership<br/>そうとう【総統】supreme ruler; generalissimo / president (of Taiwan) / fuhrer; fuehrer<br/>とうかつ【統括】unification; bringing together; generalization / control; supervision<br/>とうすい【統帥】supreme command; high command<br/>すべる【統べる】to control; to supervise<br/>とうかつ【統括】unification; bringing together; generalization / control; supervision<br/>とうぎょ【統御】control<br/>けいとうてき【系統的】systematic<br/>とうかく【統覚】apperception	36	トウ	す.べる, ほび.る	1347	780	1	[sound:RTK1_keyword_jp_1447..mp3]	[sound:RTK1_keyword_en_1447.mp3]
1448	"<img src=""E7B59E.png"" />"	strangle			絞め殺す	しめころす	to strangle to death	strangle, thread, spiderman, mingle, top hat, father	Thread . . . mingle.		12	Spiderman hates going to parties and having to mingle. He wants to strangle someone after just a little small talk.	Darth Vader, who was mingling among the crowd with his hat, is spotted by Spiderman. Spiderman jumps at him to teach the villain for coming to New York. Darth Vader catches him in mid air and strangles him with the force...	絞	しぼる【搾る】to wring (towel, rag); to squeeze / to squeeze (fruit to extract juice); to press; to extract; to milk; to express milk / to rack (one's brains); to strain (one's voice) / to extort; to exploit / to chew out; to reprimand severely; to rake over the coals; to give a sound scolding; to tell someone off; to scold; to rebuke / to drill into; to train / to narrow down (one's focus); to whittle down / to gather up (curtain, etc.); to tighten (drawstring) / to stop down (lens) / to turn down (e.g. radio) / to bend (bow); to draw / to hold down; to constrict; to immobilize<br/>しめる【絞める】to strangle; to constrict<br/>しぼりだす【搾り出す】to squeeze out; to wring out<br/>ふりしぼる【振りしぼる】to muster (one's strength) / to strain (e.g. one's voice)<br/>こうさつ【絞殺】strangulation; strangling<br/>ひきしぼる【引きしぼる】to draw bow to limit; to draw aside curt<br/>しめころす【絞め殺す】to strangle to death<br/>こうしゅ【絞首】hanging; strangling to death<br/>しぼり【搾り】tye-dye; tye-dyeing / aperture (e.g. camera, iris of the eye); aperture stop; stop / contraction; squeezing; choke<br/>しぼりあげる【搾り上げる】to squeeze (to the utmost); to wring / to strain one's voice / to scold<br/>しぼりこむ【搾り込む】to squeeze; to wring out / to narrow down; to refine<br/>こうしゅけい【絞首刑】death by hanging<br/>しまる【絞まる】to be strangled; to be constricted<br/>まめしぼり【豆絞り】spotted pattern<br/>しめわざ【絞技】shime-waza (judo stranglehold)<br/>しぼりこみ【絞り込み】refinement; narrowing-down<br/>ふりしぼる【振りしぼる】to muster (one's strength) / to strain (e.g. one's voice)<br/>ひきしぼる【引きしぼる】to draw bow to limit; to draw aside curt<br/>おしぼり【御絞り】wet towel (supplied at table); hot, moistened hand towel<br/>しぼりぞめ【絞り染】tie-dye	36	コウ	しぼ.る, し.める, し.まる	1348	1691	1	[sound:RTK1_keyword_jp_1448..mp3]	[sound:RTK1_keyword_en_1448.mp3]
