1306	"<img src=""E79FAF.png"" />"	rectify			矯める	ためる	to straighten; to correct; to cure / to falsify	rectify, dart, drop, heavens, angel, heavens, mouth, hood, mouth, mouth2	<i>Dart</i> . . . <i>angel</i>. Compare your stories for <i>correct</i> (Frame 405), <i>revise</i> (Frame 362), and <i>reformation</i> (Frame 567).		17	Angels have now been given a powerful tool to rectify human behavior instantly, without delay - they have been allowed to drop darts on those who misbehave... spare the dart and spoil the man...	The darts of the angel Cupid are supposed to bring people joy, but usually just make things a lot worse. Here we see another angel flying around shooting people with the anti-darts (antidote), to rectify the situation.	矯	きょうせい【きょう正】correction (of fault, defect, flaw, etc.); remedy; rectification; redress; reform<br/>ききょう【奇矯】eccentric<br/>きょうしょく【矯飾】affectation; pretense; pretence<br/>きょうふう【矯風】reform of morals<br/>ためる【矯める】to straighten; to correct; to cure / to falsify<br/>きょうげき【矯激】radical; extreme; eccentric	33	キョウ	た.める	1221	2053	1	[sound:RTK1_keyword_jp_1306..mp3]	[sound:RTK1_keyword_en_1306.mp3]
1307	"<img src=""E6978F.png"" />"	tribe			家族	かぞく	family; members of a family	tribe, banner, direction, compass, direction, reclining, lying down, dart, drop, heavens	Banner . . . dart.		11	With a banner declaring ´Keep Out!´ and blow darts to back it up, the Amazon tribe is not that friendly.	Once tribes shot darts under their war banners, now they are putting banner ads on the internet for betting on dart-games at their casinos :(.	族	きぞく【貴族】noble; aristocrat<br/>かぞく【家族】family; members of a family<br/>ぞく【族】tribe; clan; band / (taxonomical) tribe / group (of the periodic table)<br/>やから【族】party (of people); set (of people); clan; family; fellow<br/>いちぞく【一族】family; relatives; dependents / household<br/>しゅぞく【種族】race; tribe; family; species<br/>ぶぞく【部族】tribe; clan; house<br/>みんぞく【民族】people; race; nation; ethnic group; ethnos<br/>おうぞく【王族】royalty<br/>ばんぞく【蕃族】savage tribe<br/>ぞくちょう【族長】patriarch; head of a family<br/>どうぞく【同族】same family (race, tribe)<br/>ごうぞく【豪族】powerful family (clan)<br/>うから【親族】blood relative<br/>しんぞく【親族】relatives<br/>いぞく【遺族】bereaved family<br/>けつぞく【血族】blood relative<br/>しぞく【士族】family or person with samurai ancestors<br/>かぞく【華族】noble; peer<br/>かぞくづれ【家族連れ】taking the family along	33	ゾク		1222	353	3	[sound:RTK1_keyword_jp_1307..mp3]	[sound:RTK1_keyword_en_1307.mp3]
1308	"<img src=""E79FA5.png"" />"	know			知る	しる	know	know, dart, drop, heavens, mouth	Dart . . . mouth.		8	I should know. After all, I did graduate from Dartmouth!	[know; wisdom] [An arrow 矢 like mouth 口] If you know the answers, they will fly like darts from your mouth.	知	しょうち【承知】knowledge; awareness / consent; acceptance; assent; admitting; compliance; agreement; acknowledgment; acknowledgement / forgiving; pardoning; excusing<br/>ちしき【智識】knowledge; information<br/>ち【智】wisdom / jnana (higher knowledge)<br/>かんち【感知】perception; sensing; noticing<br/>ちえ【智恵】wisdom; wit; sagacity; sense; intelligence / prajna (insight leading to enlightenment)<br/>しりあい【知合】acquaintance<br/>たんち【探知】detection<br/>しらす【知らす】to inform; to notify / to know / to reign<br/>みち【未知】not yet known; unknown; strange<br/>ちかく【知覚】perception<br/>しりあう【知り合う】to get to know (someone); to make acquaintance<br/>みしらぬ【見しらぬ】strange; unfamiliar; unknown<br/>ごぞんじ【ご存じ】knowing / (an) acquaintance<br/>ちせい【知性】intelligence<br/>しらず【不知】not having; unaffected by / aside; I don't know about ... / I know not whether; I know not if<br/>さっち【察知】sense; infer<br/>しらせ【報せ】notice; notification<br/>しらせる【報せる】to notify; to advise; to inform<br/>ちてき【知的】intellectual<br/>ちじん【知人】friend; acquaintance	33	チ	し.る, し.らせる	1223	186	3	[sound:RTK1_keyword_jp_1308..mp3]	[sound:RTK1_keyword_en_1308.mp3]
1309	"<img src=""E699BA.png"" />"	wisdom			智	ち		wisdom, know, dart, drop, heavens, mouth, sun, day, tongue wagging	Know . . . sun.		12	Wisdom is knowing everything OVER the sun (fools assume everything UNDER).	Knowing more each day, brings wisdom.	智	ち【智】wisdom / jnana (higher knowledge)<br/>ちえ【智恵】wisdom; wit; sagacity; sense; intelligence / prajna (insight leading to enlightenment)<br/>ちえ【智恵】wisdom; wit; sagacity; sense; intelligence / prajna (insight leading to enlightenment)<br/>ちしき【智識】knowledge; information<br/>めいち【明智】sagacity; wisdom; intelligence<br/>えいち【叡智】wisdom; intelligence; intellect<br/>じんち【人智】human intellect; knowledge<br/>りち【理智】intellect; intelligence<br/>きち【機智】wit; resources; tact<br/>ちしゃ; ちさ【智者】sage; wise man; wise person; man of wisdom / buddha; bodhisattva; enlightened priest<br/>ちりゃく【智略】ingenuity; resourcefulness<br/>こうち【狡智】craft; cunning<br/>ちのう【智能】intelligence; intellect; brains<br/>かんち【奸智】cunning; craft; wiles<br/>じょうち【上智】supreme wisdom<br/>せち【世智】worldly wisdom; gumption / stingy person<br/>ちりょく【智力】wisdom; intellectual power; intelligence; mental capacity; brains<br/>ぜんち【全智】omniscience<br/>さいち【才智】wit and intelligence<br/>ちゆう【智勇】wisdom and courage	33	チ		1224		1	[sound:RTK1_keyword_jp_1309..mp3]	[sound:RTK1_keyword_en_1309.mp3]
1310	"<img src=""E68CA8.png"" />"	shove			挨拶する	あいさつする	to greet	shove, finger, fingers, elbow, dart, drop, heavens	Fingers . . . elbow . . . dart.		10	In the busy pub, one of the dart players shoved his dart into my elbow by accident when it nearly slipped out of his fingers.	Your fingers slip when someone´s elbow shoves you, causing you to drop the dart you were about to throw. But as you can see, their elbow is very small, so you decide they´re too weak to shove back.	挨	あいさつ【挨拶】greeting; greetings; salutation; salute; polite set phrase used when meeting or parting from somebody / polite set phrase used to express apology, sympathy, congratulations, etc. / speech (congratulatory or appreciative); address / reply; response / revenge; retaliation / a fine thing to say (used as part of a sarcastic response to a rude remark) / dialoging (with another Zen practitioner to ascertain their level of enlightenment)	33	アイ	ひら.く	2248	1396	0	[sound:RTK1_keyword_jp_1310..mp3]	[sound:RTK1_keyword_en_1310.mp3]
1311	"<img src=""E79F9B.png"" />"	halberd			矛	ほこ	long-handled Chinese spear; lance; pike / weapon; arms / grip of a bow	halberd, beforehand	The <b>halberd´s</b> battle-ax head and long shaft are depicted here. Take care with the number and order of the strokes.		5	マオ Zedong always carried a halberd.	Make the halberd a heroic warrior (perhaps of scandinavian origin) who weilds this polearm - the most effective, brutal and vicious one - with great skill. He can use it to hook, pierce and chop (the three strokes).	矛	むじゅん【矛盾】contradiction; inconsistency<br/>ほこ; とかり【戈】long-handled Chinese spear; lance; pike / weapon; arms / grip of a bow<br/>ほこさき【矛先】point of spear; spearhead / brunt; aim of attack; force of argument	33	ム, ボウ	ほこ	1225	1065	1	[sound:RTK1_keyword_jp_1311..mp3]	[sound:RTK1_keyword_en_1311.mp3]
1312	"<img src=""E69F94.png"" />"	tender			柔らか	やわらか　【柔らか】	gentle; soft; tender	tender, halberd, beforehand, tree, wood	Halberd . . . tree.		9	[tender; weakness; gentleness; softness] Love me tender, Love me perfect, Never cheat on me. Or I´ll impale you on my Halberd, And hang ya atop a tree...	Use a halberd to tenderize a tree: halberds can chop, poke, and slash, so it´s all good!	柔	やわらかい【柔かい】soft; tender; limp<br/>じゅう【柔】softness; gentleness; weakness<br/>やわら【和ら】judo; jujutsu<br/>やわ【和】soft; fragile; weak; poorly built; insubstantial<br/>やわらか【柔らか】soft; tender; limp; subdued (colour or light) (color); gentle; meek<br/>じゅうなん【柔軟】flexible; lithe; soft; pliable<br/>じゅうどう【柔道】judo<br/>やわらかい【柔かい】soft; tender; limp<br/>にゅうわ【柔和】gentleness; mildness; meekness<br/>やわはだ【柔肌】soft fair skin<br/>じゅうなんせい【柔軟性】flexibility; pliability; softness; elasticity<br/>じゅうじゅん【従順】obedient; gentle; meek; submissive; docile<br/>ゆうじゅうふだん【優柔不断】shilly-shally; indecisiveness<br/>かいじゅう【懐柔】winning over; placation; gentle persuasion<br/>じゅうじゅつ【柔術】jujitsu (classical Japanese martial art, usually referring to fighting without a weapon); jiujitsu; jujutsu<br/>やわら【和ら】judo; jujutsu<br/>やわらかみ【柔らかみ】(touch of) softness<br/>にゅうじゃく【柔弱】weakness; effeminacy; enervation<br/>ものやわらか【もの柔らか】mild; mild-mannered; gentle<br/>ゆうじゅう【優柔】indecisiveness	33	ジュウ, ニュウ	やわ.らか, やわ.らかい, やわ, やわ.ら	1226	1331	2	[sound:RTK1_keyword_jp_1312..mp3]	[sound:RTK1_keyword_en_1312.mp3]
1313	"<img src=""E58B99.png"" />"	task			務め	つとめ　【務め】	duty; task	task, halberd, beforehand, taskmaster, power, muscle, arnold	Halberd . . . taskmaster . . . muscle.		11	It is with the halberd he holds that the taskmaster exerts his power over those actually performing the task.	"So many video games have a ""boss"" stage you must pass in order to advance to the next level. Here, your task is to use your halberd to beat the taskmaster with the huge, bulging muscles."	務	にんむ【任務】duty; function; office; mission; task<br/>じむ【事務】business; office work<br/>じむしょ【事務所】office<br/>ぎむ【義務】duty; obligation; responsibility<br/>きんむ【勤務】service; duty; work<br/>つとめる【務める】to work (for); to be employed (at); to serve (in) / to serve (as); to act (as); to fill (the position of); to play the role (of) / to conduct a religious service<br/>しつむ【執務】performance of one's official duties<br/>しょくむ【職務】professional duties<br/>けいむしょ【刑務所】prison; penitentiary<br/>ぎょうむ【業務】business; affairs; duties; work; procedure; task; action; function; (business) operations; operational<br/>せんむ【専務】managing director; special duty; conductor<br/>いむ【医務】medical affairs<br/>せいむ【政務】government affairs<br/>つとめ【務め】service; duty; business; responsibility; task / Buddhist religious services<br/>じょうむ【乗務】doing transport-related work<br/>ようむいん【用務員】orderly; janitor<br/>ぐんむ【軍務】military and naval affairs; military service<br/>こうむ【公務】official business; public business<br/>つとまる【務まる】to be fit for; to be equal to; to function properly<br/>せきむ【責務】duty; obligation	33	ム	つと.める	1227	815	2	[sound:RTK1_keyword_jp_1313..mp3]	[sound:RTK1_keyword_en_1313.mp3]
1314	"<img src=""E99CA7.png"" />"	fog			霧	きり	fog, mist	fog, rain, weather, task, halberd, beforehand, taskmaster, power, muscle, arnold	Weather/rain . . . task.		19	This fog is the perfect weather for us to perform our task undetected.	FOG is easy to associate with the RAIN primitive. So think of FOG as a type of RAIN that is slow at the TASK of getting the place wet.	霧	きり【霧】fog; mist / spray<br/>むさん【霧散】dispersing; vanishing<br/>きりさめ【霧雨】drizzle; light rain<br/>のうむ【濃霧】heavy fog; dense fog; thick fog<br/>ごりむちゅう【五里霧中】totally at a loss; lose one's bearings; in a maze; in a fog; all at sea; up in the air; mystified; bewildered<br/>あさぎり【朝霧】morning fog; morning mist<br/>ふんむ【噴霧】spraying<br/>さぎり【狭霧】mist; fog<br/>うんさんむしょう【雲散霧消】vanishing like mist<br/>よぎり【夜霧】night fog<br/>うんむ【雲霧】clouds and fog<br/>えんむ【煙霧】haze; mist; fog; smog<br/>ひょうむ【氷霧】ice fog<br/>むひょう【霧氷】rime; hoarfrost; silver frost<br/>むちゅう【霧中】in the fog<br/>むてき【霧笛】foghorn<br/>きりふき【霧吹き】spray; atomizer; atomiser<br/>めいむ【迷霧】dense fog	33	ム, ボウ, ブ	きり	1228	2111	1	[sound:RTK1_keyword_jp_1314..mp3]	[sound:RTK1_keyword_en_1314.mp3]
1315	"<img src=""E78FAD.png"" />"	squad			班	はん　【班】	group; squad	squad, sword, spear, cutlass, king, jewel, ball, king2, jewel2, ball2	Spear . . . two balls.		10	Am I the only one who took this as penis and balls? In order to be in the man-squad, naturally you need to have two balls with your ´spear´ in the middle there.	Here we have two kings trying out for the cheer-leading squad. A spear on the floor separates their dancing areas.	班	はん【班】group; party; team / squad; section<br/>はんちょう【班長】squad leader; honcho; team leader; group leader<br/>きゅうごはん【救護班】relief squad; rescue party<br/>しゅはん【首班】head; leader; Prime Minister	33	ハン		1229	970	1	[sound:RTK1_keyword_jp_1315..mp3]	[sound:RTK1_keyword_en_1315.mp3]
1316	"<img src=""E5B8B0.png"" />"	homecoming			帰省	きせい	homecoming, going (back) to one's hometown	homecoming, sword, spear, cutlass, feather duster, broom, apron, crown, towel	<i>Spear</i> . . . <i>broom</i> . . . <i>apron</i>. The character for <i>lady</i> (Frame 1234) shares the same right side as this character, which does not bode for a very happy <b>homecoming</b>.		10	A female warrior returns home from battle. Her husband takes away her spear to symbolize the end of fighting and gives her a broom and an apron. “Boy, this is some kind of HOMECOMING,” thinks the veteran. (Adapted from johnskb).	Well, the boss man warrior upon his homecoming has set aside his spear. Remember the lady (#1151) (who put aside her broom and apron)? I wonder what they´re doing now?	帰	かえり【帰り】return; coming back<br/>きす【帰す】to come to (in the end); to end in / to attribute; to blame<br/>かえす【帰す】to send (someone) back; to send (someone) home<br/>きかん【帰還】repatriation; return / (electrical) feedback<br/>きたく【帰宅】returning home<br/>きこく【帰国】return to one's country<br/>かえりみち【帰り路】the way back or home; return trip<br/>もちかえる【持ち帰る】to bring back; to carry home; to take out (e.g. food)<br/>ふっき【復帰】return; comeback; reinstatement / carriage return; CR<br/>きと【帰途】on the way back; returning<br/>きろ【帰路】one's way back<br/>もちかえり【持ち帰り】takeout (i.e. food); take-out; takeaway; take-away<br/>きとう【帰投】return to base of soldiers, military aircraft or ships<br/>にげかえる【逃げ帰る】to scurry home; to run home; to fly back<br/>かえりじたく【帰り支度】preparations for returning (home)<br/>きせい【帰省】homecoming; returning home<br/>つれかえる【つれ帰る】to bring (someone) back home; to take (someone) back home<br/>きちゃく【帰着】return; conclusion<br/>かえりがけ【帰りがけ】on the way back / when about to go back<br/>ききょう【帰郷】homecoming; return to one's home	33	キ	かえ.る, かえ.す, おく.る, とつ.ぐ	1230	106	3	[sound:RTK1_keyword_jp_1316..mp3]	[sound:RTK1_keyword_en_1316.mp3]
1317	"<img src=""E5BC93.png"" />"	bow			弓	ゆみ　【弓】	archery; bow	bow	This character pictures the bent wooden <b>bow</b>. Later we will learn how to make the <i>bowstring</i> that goes with it (Frame 1490). If you stretch this character out and see the indentation on the left as its handle, the pictography should be clearer.		3	My personification for this primative is Legolas from the Lord of the Rings: a master at the bow. I suppose robin hood etc would work too.	I have a BOW made from a SNAKE that I BOUND UP. He sure wasn´t happy!	弓	たらし【執】bow (and arrow; esp. of a noble)<br/>ゆみ; ゆ【弓】bow (and arrow) / archery / bow (for a violin, etc.)<br/>きゅう【弓】bow (and arrow) / unit of distance to an archery target (approx. six feet) / unit of distance for land surveying (approx. eight feet)<br/>まゆみ; マユミ【真弓】Japanese spindle tree (Euonymus sieboldianus)<br/>きゅうどう【弓道】(Japanese) archery<br/>ゆみや; きゅうし【弓矢】bow and arrow<br/>こきゅう【胡弓】kokyu (3 or 4-stringed bowed Japanese musical instrument) / any Oriental string instrument played with a bow<br/>いしゆみ【弩】crossbow (incl. large models operated by a number of people) / netted apparatus atop a wall containing large stones, which were dropped onto attackers by cutting the net / slingshot; catapult<br/>はんきゅう【半弓】small bow<br/>ゆみなり; ゆみがた; きゅうけい【弓形】arched; crescent-shaped; bow-shaped; segment<br/>ゆみづる; ゆづる; ゆづら【弓弦】bowstring<br/>きゅうば【弓馬】archery and horsemanship<br/>だいきゅう; おおゆみ【大弓】bow; longbow<br/>ようきゅう; あげゆみ【揚弓】small toy bow that can be shot while sitting, popular in the Edo period<br/>ごうきゅう【強弓】tightly drawn bow<br/>きゅうせん【弓箭】bows and arrows; war<br/>ゆみはり【弓張】stringing a bow; person who strings bows / crescent moon / paper lantern with a bow-shaped handle<br/>きゅうじゅつ【弓術】(Japanese) archery<br/>ゆんぜい【弓勢】strength needed to pull back a bow<br/>ゆみひく【弓引く】to bend a bow; to shoot an arrow / to rise up against; to rebel against	33	キュウ	ゆみ	1231	107	1	[sound:RTK1_keyword_jp_1317..mp3]	[sound:RTK1_keyword_en_1317.mp3]
1318	"<img src=""E5BC95.png"" />"	pull			引く	ひく	draw, pull	pull, bow, stick	Bow . . . walking stick.		4	Put a walking stick in the bow and pull it back, ready to fire at the geezer.	This is actually a bow and an arrow. (Real origin of this kanji). Pull and release to fire!	引	ひっぱる【引っぱる】to pull; to draw; to pull tight / to string (lines); to run (cable); to stretch / to pull towards oneself (e.g. someone's sleeve) / to drag; to haul; to tow / to lead (e.g. one's followers) / to take someone somewhere (e.g. a suspect to the police) / to tempt into joining; to strongly invite to join / to delay; to prolong / to lengthen the pronunciation (of a word) / to quote; to cite; to reference / to pull the ball / to wear; to put on<br/>ひきずる【引ずる】to drag along; to pull / to force someone along / to prolong; to drag out / to influence strongly; to seduce<br/>ひきぬく【引きぬく】to extract; to uproot; to pull out / to headhunt; to lure away<br/>ごういん【強引】overbearing; coercive; pushy; forcible; high-handed<br/>ひきよせる【引きよせる】to draw or pull something towards oneself (e.g. chair)<br/>ひきかえす【引きかえす】to repeat; to send back; to bring back; to retrace one's steps<br/>ひっぱる【引っぱる】to pull; to draw; to pull tight / to string (lines); to run (cable); to stretch / to pull towards oneself (e.g. someone's sleeve) / to drag; to haul; to tow / to lead (e.g. one's followers) / to take someone somewhere (e.g. a suspect to the police) / to tempt into joining; to strongly invite to join / to delay; to prolong / to lengthen the pronunciation (of a word) / to quote; to cite; to reference / to pull the ball / to wear; to put on<br/>ひきうける【引き受ける】to be responsible for / to take over; to take up / to guarantee; to undertake / to contract (a disease)<br/>ひきだす【引きだす】to pull out; to take out; to draw out; to withdraw<br/>とりひき【取引】transactions; dealings; business<br/>ひきあげる【引きあげる】to pull up; to drag up; to lift up / to increase; to raise (e.g. taxes) / to withdraw; to leave; to pull out; to retire / to promote (someone to a higher position) / to return home / to expedite the schedule<br/>ひっかかる【引っかかる】to be caught in; to be stuck in / to stop by; to drop in for a short visit; to be delayed; to take time / to get mixed up in (trouble); to get entangled in (a problem); to be involved with / to fall for (a trick); to be deceived; to be cheated / to be on one's mind; to worry one; to be bothered by; to feel uneasy / to be obstructed; to be hindered / to splash<br/>ひきがね【引金】trigger; gunlock<br/>ひきとる【引きとる】to take over; to take back; to collect; to claim / to take charge of; to take custody of; to look after; to take care of; to adopt / to retire to a private place; to withdraw; to get out<br/>ひっ【引っ】goes before a verb to strengthen its meaning or to add emphasis<br/>びき【引き】-off (price reduction)<br/>ひき【引き】pull; patronage; influence / tug / discount<br/>ひきさく【引きさく】to tear up; to tear off; to split<br/>ひきおこす【引きおこす】to cause; to induce / to pull upright; to help up (e.g. a fallen person)<br/>ひっこす; ひきこす【引っこす】to move (house); to change residence	33	イン	ひ.く, ひ.き, ひ.き-, -び.き, ひ.ける	1232	81	3	[sound:RTK1_keyword_jp_1318..mp3]	[sound:RTK1_keyword_en_1318.mp3]
1319	"<img src=""E5BC94.png"" />"	condolences			弔う	とむらう	to mourn for; to hold a memorial service for; to condole	condolences, bow, walking stick	<i>A bow</i> . . . wrapped around a <i>walking stick</i>.		4	Perhaps a pictograph of a soldier´s weapons--his sword and bow-placed ceremonially over his body before burial, while people offer their condolences.	Send your condolences to the old geezer whom you shot the walking stick into with your bow. (see pull (#1232)).	弔	ちょうし【弔詞】message of condolence; memorial address<br/>とむらう; とぶらう【弔う】to mourn for; to condole with (family, etc.) / to hold a memorial service (for)<br/>ちょうもん【弔問】condolence call<br/>とむらい; とぶらい; ともらい【弔い】funeral; burial; condolence<br/>とむらいがっせん【弔い合戦】battle of revenge<br/>ちょうじ【弔辞】message of condolence; memorial address<br/>ちょうほう【弔砲】artillery funeral salute<br/>ちょうい【弔意】condolence; sympathy; mourning<br/>ちょうい【弔意】condolence; sympathy; mourning<br/>ちょうぶん【弔文】funeral address<br/>ついちょう【追弔】mourning<br/>ちょうじ【弔事】mourning<br/>ちょうしょう【弔鐘】funeral bell	33	チョウ	とむら.う, とぶら.う	1233	1034	1	[sound:RTK1_keyword_jp_1319..mp3]	[sound:RTK1_keyword_en_1319.mp3]
1320	"<img src=""E5BC98.png"" />"	vast			弘遠	こうえん	vast and far-reaching	vast, bow, elbow	Bow . . . elbow.		5	If you pull the bow back with your elbow, you can shoot a vast distance.	The valley was so vast that if you yelled elbow! you could hear it echo bow, bow, bow.	弘	ぐほう【弘法】spreading Buddhist teachings<br/>ひろめる【広める】to spread; to propagate; to popularize; to disseminate / to broaden; to extend; to widen; to enlarge<br/>こうあん【弘安】Kouan era (1278.2.29-1288.4.28)<br/>げんこう【元弘】Genkou era (1331.8.9-1334.1.29)<br/>こうじ【弘治】Kouji era (1555.10.23-1558.2.28)<br/>ぐぜい【弘誓】Buddha's great vows<br/>ぐずう; ぐつう【弘通】spread (of Buddhist teachings)	33	コウ, グ	ひろ.い	1234		1	[sound:RTK1_keyword_jp_1320..mp3]	[sound:RTK1_keyword_en_1320.mp3]
