118	"<img src=""E79FB3.png"" />"	stone			石	いし	stone	stone, cliff, mouth	With a <i>mouth</i> under a <i>cliff</i>, what else could we have here but the entrance to a secret cavern, before which a great <b>stone</b> has been rolled so that none may enter. Perhaps it is the hiding place where Ali Baba and his band of thieves have stored their treasures, in which case that magic word known to every school child who ever delighted over the tales of the <i>Arabian Nights</i> should be enough to push the <b>stone</b> aside. But take care - the <i>cliff</i> is steep, and one slip will send you tumbling down into the ravine below. This is the one and only time that the second stroke in <i>cliff</i> will reach over to the middle of the horizontal stroke. If you think of the edge jutting outwards (in keeping with the story above), the problem should be taken care of.	"* The <i>stone</i> is a quite common primitive element, which is not restricted to great boulders but used of <i>stones</i> or <i>rocks</i> of any size or shape.	 "	5	Indiana Jones jumps up and grabs the lip of cliff just in time to evade the huge STONE rolling out of the mouth of the cave!	There´s a VERY simple way to remember this, in case the cliff thing isn´t working for you... Just see it as a stone [いし] being hammered by a miner searching for jewel stones [ほうせき] ;).	石	"こく【斛】measure of volume (approx. 180.39 liters, 6.37 cub. ft.) / measure of a Japanese-style boat's loading capacity (approx. 278.26 liters)<br/>いし【石】stone / gem; jewel<br/>たいせき; おおいし【大石】large stone; boulder / large group of stones (in the game of go)<br/>ほうせき【宝石】gem; jewel; precious stone<br/>しゃくじん; いしがみ【石神】stone which is worshipped; image of a god in stone<br/>いしだん【石段】(flight of) stone steps<br/>いしだたみ【石だたみ】(flat) stone paving; sett; flagstone / (chocolate) pavé; various rectangular pastries, esp. layered chocolate<br/>だいりせき【大理石】marble<br/>こいし【小石】pebble<br/>せっけん【石けん】soap<br/>さすが【流石】as one would expect / still; all the same / even... (e.g. ""even a genius..."")<br/>いしがき; いしがけ【石垣】stone wall<br/>せきぞう【石像】stone statue<br/>せきゆ【石油】oil; petroleum; kerosene<br/>いしかべ; せきへき【石壁】stone wall; dry wall / rocky cliff; stone precipice<br/>いしづくり【石造り】(made of) stone<br/>がんせき【岩石】rock<br/>せきたん; いしずみ【石炭】coal<br/>こうせき【鉱石】ore; mineral; crystal<br/>しろいし【白石】white stone / white (go pieces)"	7	セキ, シャク, コク	いし	113	47	2	[sound:RTK1_keyword_jp_118..mp3]	[sound:RTK1_keyword_en_118.mp3]
119	"<img src=""E88296.png"" />"	resemblance			肖る	あやかる	to be named after	resemblance, spark, candle, small, little, moon, month, flesh, part of the body	"The word <b>resemblance</b> should suggest, among other things, a son´s <b>resemblance</b> to his father. A ""chip off the old block"" is the way we often put it, but the character is more simple. It speaks of a <i>little</i> bit of <i>flesh</i>."	"* When used as a primitive, the sense of <i>resemblance</i> is replaced by that of <i>spark</i> or <i>candle</i>. (If you want an explanation: the kanji for <i>moon</i> also carries a secondary sense of <i>fire</i>, which we omitted because we are keeping that meaning for other primitives.)	 "	7	Using DNA matching, a very little bit of flesh can be used to show the resemblence between family members.	Hey baby, it might be a little bit of flesh now, but in a moment it´ll bear a strong resemblance to a candlestick.(nudge nudge, wink wink).	肖	しょうぞう【肖像】portrait<br/>ふしょう【不肖】unworthiness (of one's father, teacher, etc.) / incompetence; foolishness / misfortune; unluckiness / I; me<br/>あやかる【肖る】to share good luck; to follow (someone's) example / to be named after	7	ショウ	あやか.る	114	1168	1	[sound:RTK1_keyword_jp_119..mp3]	[sound:RTK1_keyword_en_119.mp3]
120	"<img src=""E7A19D.png"" />"	nitrate			硝	しょう	nitrate	nitrate, stone, rock, resemblance, spark, candle, small, little, moon, month, flesh, part of the body	The word <b>nitrate</b> should immediately suggest a beaker of <b>nitric</b> acid, which, as every high-school chemistry student knows, can eat its way through some pretty tough substances. Here we imagine pouring it over a <i>rock</i> and watching the <i>sparks</i> fly as it bores a hole through the rock.		12	That stone has sparks coming out of it! Someone must have poured nitrate acid on it.	"Salpetre is the common name for Nitrate coming from Latin ""sal petrae"" or stone salt. It is also a component of gun powder so including a candle in this kanji can be quite explosive!"	硝	ガラス; しょうし【硝子】glass; pane / vitreous<br/>しょうえん【硝煙】gunpowder smoke<br/>えんしょう【焔硝】gunpowder<br/>しょうせき【硝石】saltpeter<br/>しょうさん【硝酸】nitric acid<br/>しょうさんぎん【硝酸銀】silver nitrate; AgNO3<br/>しょうさんカリウム【硝酸カリウム】potassium nitrate; saltpeter<br/>しょうえんだんう【硝煙弾雨】smoke of powder and hail of bullets; (in) the thick of the raging battle	7	ショウ		115	1686	1	[sound:RTK1_keyword_jp_120..mp3]	[sound:RTK1_keyword_en_120.mp3]
121	"<img src=""E7A095.png"" />"	smash			砕く	くだく	to smash	smash, stone, rock, ninety, nine, baseball, ten, needle	We begin with the two elements on the right, <i>baseball</i> and <i>needle</i>. Since they will be coming together from time to time, let us give the two of them the sense of a <i>game of cricket</i> in which a <i>needle</i> is laid across the wicket. Then imagine using a <i>rock</i> for a ball. A <b>smash</b> hit would probably splinter the bat in all directions, and a <b>smashing</b> pitch would do the same with the <i>needle</i> wicket.		9	To SMASH a STONE you need to hit it NINE or TEN times.	The Stones (the Rolling Stones) are 90 aged but they´ve done a new SMASH hit!	砕	くだける【摧ける】to break (into pieces); to be broken; to be smashed / to collapse; to crumble; to decline; to cool (e.g. enthusiasm); to dampen (e.g. one's will to fight) / to become less formal; to throw off reserve; to become affable / to become easy to understand (e.g. a story) / to be worried<br/>くだく【摧く】to break; to smash<br/>ふんさい【粉砕】pulverization; pulverisation; smashing; demolishing<br/>うちくだく; ぶちくだく【打ち砕く】to smash; to crush<br/>はさい【破摧】crushing; smashing; cracking to pieces<br/>かみくだく【噛み砕く】to crunch; to masticate / to simplify; to explain plainly<br/>ぎょくさい【玉摧】honourable defeat; honorable defeat; honourable death; honorable death; death without surrender / trying but being utterly beaten; being completely rejected when professing one's love<br/>さいひょう【砕氷】ice breaking<br/>かさいりゅう【火災流】pyroclastic flow (type of volcanic eruption); stone wind<br/>ふんこつさいしん【粉骨砕身】making one's best exertions<br/>さいへん【砕片】debris<br/>こしくだけ【腰砕け】collapsing in the middle of a bout / breaking down (while in the middle of something); faltering halfway<br/>げきさい【撃砕】pulverising<br/>あっさい【圧砕】crushing	7	サイ	くだ.く, くだ.ける	116	1346	1	[sound:RTK1_keyword_jp_121..mp3]	[sound:RTK1_keyword_en_121.mp3]
122	"<img src=""E7A082.png"" />"	sand			砂	すな	sand	sand, stone, rock, few	Good <b>sand</b> for beaches has <i>few</i> or no <i>stones</i> in it. That means that all of us whose feet have been spoiled by too much time in shoes don´t have to watch our step as we cavort about.		9	Here´s how I remember that stone is on the left. This is because sand starts as stones, and only later they become few.	In good SAND, stones are few, if any.	砂	すな; すなご; いさご【沙】sand; grit / gold dust; silver dust<br/>さばく【沙漠】desert<br/>すなはま【砂浜】sandy beach<br/>さとう【砂糖】sugar<br/>じゃり; ざり【砂利】gravel; ballast; pebbles / child; rugrat; ankle-biter<br/>さじん【砂塵】cloud of dust; sandstorm<br/>どしゃ【土砂】earth and sand<br/>さきゅう; しゃきゅう【沙丘】sand dune; sand hill<br/>すなじ; すなち【砂地】sandy soil<br/>すなぼこり【砂ぼこり】cloud of dust (sand, etc.)<br/>どしゃぶり【土砂降り】downpour; pouring rain; cloudburst; pelting rain; heavy rain<br/>すなあらし【砂嵐】sandstorm<br/>すなけむり【砂煙】cloud of sand (dust, etc.)<br/>すなつぶ【砂粒】grains of sand<br/>すなば【砂場】sand pit; sandbox<br/>すなどけい【砂時計】hourglass<br/>さてつ【砂鉄】iron sand; magnetite sand<br/>すなぼこり【砂ぼこり】cloud of dust (sand, etc.)<br/>さきん; しゃきん【砂金】gold dust<br/>どしゃくずれ【土砂崩れ】landslide	7	サ, シャ	すな	117	879	2	[sound:RTK1_keyword_jp_122..mp3]	[sound:RTK1_keyword_en_122.mp3]
123	"<img src=""E5A6AC.png"" />"	jealous			妬む	ねたむ	to be jealous	jealous, woman, stone, rock	It should not be hard to leep from the key word to the image of a <i>woman</i> who is <b>jealous</b> of the <i>rock</i> that another <i>woman</i> is sporting on the third finger of her left hand.		8	The jealous woman bashed the brains in of the guy who betrayed her, with a stone.	Every woman wants a huge stone on her finger to make her friends jealous.	妬	しっと【嫉妬】jealousy; envy<br/>ねたむ; そねむ【妬む】to be jealous of; to envy; to begrudge<br/>やく【妬く】to be jealous of; to be envious of; to envy<br/>やける【妬ける】to burn; to be roasted; to be heated; to be sunburnt; to fade (in the sun); to glow red (i.e. of the sky at sunset) / to be jealous; to be envious<br/>ねたましい【妬ましい】jealous; envious<br/>としん【妬心】jealousy	7	ト, ツ	ねた.む, そね.む, つも.る, ふさ.ぐ	2195	1191	0	[sound:RTK1_keyword_jp_123..mp3]	[sound:RTK1_keyword_en_123.mp3]
124	"<img src=""E5898A.png"" />"	plane			削る	けずる	to plane	plane, resemblance, spark, candle, small, little, moon, month, flesh, part of the body, sword, sabre, saber	Long before the invention of the carpenter´s <b>plane</b>, people used knives and machetes (or here, <i>sabers</i>) to smooth out their woodwork. If you have ever seen the process, you will have been amazed at the speed and agility with which the adept can <b>plane</b> a hunk of wood into shape. Indeed, you can almost see the <i>sparks</i> fly from their <i>sabers</i>.		9	Sparks will fly if you attempt to PLANE your sabre.	With today´s strict air regulations, carrying a sabre onto a plane could spark quite a commotion.	削	けずる【削る】to shave (wood or leather); to sharpen; to plane; to whittle; to pare; to scrape off / to shave off (e.g. a budget, expenses, a salary, etc.); to curtail; to cut down / to cross out; to reduce; to curtail; to remove; to erase; to delete<br/>はつる【削る】to shave off (esp. concrete) / to take a percentage; to take a cut<br/>さくじょ【削除】elimination; cancellation; deletion; erasure; DEL (key)<br/>けずりとる【削りとる】to shave off; to scrape off<br/>そぐ【削ぐ】to chip (off); to shave (off); to slice (off); to sharpen / to dampen (e.g. enthusiasm); to discourage; to weaken; to reduce<br/>くっさく【掘削】digging out; excavation<br/>さくげん【削減】cut; reduction; curtailment<br/>けずれる【削れる】to be shaved or planed<br/>そげる【削げる】to split; to be split; to splinter<br/>あらけずり【粗削り】rough-hewn; incomplete; unrefined; still in the process of being formed<br/>あらけずり【粗削り】rough-hewn; incomplete; unrefined; still in the process of being formed<br/>てんさく【添削】correction; looking over; touching up<br/>せっさく【切削】cutting; a cut; machining	7	サク	けず.る, はつ.る, そ.ぐ	118	1274	1	[sound:RTK1_keyword_jp_124..mp3]	[sound:RTK1_keyword_en_124.mp3]
125	"<img src=""E58589.png"" />"	ray			光	ひかり	valgus	ray, small, little, human legs	"There are really only 2 primitives here, <i>little</i> and <i>human legs</i>. The 4th stroke that separates them is added for reasons of aesthetics. (If that doesn´t make sense, try writing the kanji without it and see how ugly the results look, even to your beginner´s eye.) Now if you have wondered what those little particles of ""dust"" are that dance around in the light-<b>rays</b> that come through the window and fall on your desk, try imagining them as <i>little</i> and disembodied <i>human legs</i>, and you should have no trouble with this character."		6	A ray of light is not a wave but made of little photons with human legs.	The ray from Honey I Shrunk the Kids made people little - ha! look at them run around on their tiny legs!	光	ひかる【光る】to shine; to glitter; to be bright<br/>こうけい【光景】scene; spectacle; sight; view<br/>せんこう【せん光】flash; glint<br/>げっこう【月光】moonlight; moonbeam<br/>にっこう【日光】sunlight<br/>こうせん【光線】beam; light ray<br/>かんこう【観光】sightseeing<br/>ようこう【陽光】sunshine; sunlight<br/>こうし【光子】photon<br/>こうたく【光沢】brilliance; polish; lustre; luster; glossy finish (of photographs)<br/>こうえい【光栄】honour; honor; glory; privilege<br/>こうてん【光点】luminous point<br/>けいこう【蛍光】fluorescence<br/>がんこう【眼光】glint in eye; discernment<br/>でんこう【電光】lightning<br/>はっこう【発光】luminescence; radiation<br/>こうそく【光速】speed of light<br/>えいこう【栄光】glory<br/>りんこう; リンこう【リン光】phosphorescence<br/>こうねん【光年】light year	7	コウ	ひか.る, ひかり	119	129	3	[sound:RTK1_keyword_jp_125..mp3]	[sound:RTK1_keyword_en_125.mp3]
126	"<img src=""E5A4AA.png"" />"	plump			太い	ふとい	fat; thick	plump, large, St. Bernard, drop	"""<b>Plump</b>"" is one of those delightful English words that almost sound like their meaning. No sooner do you hear it than you think of a round and ample-bodied person falling into a sofa like a <i>large drop</i> of oil plopping into a fishbowl - kerrrr-<b>plump</b>!"		4	A large person with a big drop of sweat dripping off of him because he is so plump.	"Fat(""plump"") men always have small penises.....the kanji is a combination of ""large"" with a drop(representing the small penis between his legs)."	太	ふと【太】fat; fatty / grand; magnificent; excellent<br/>たいよう【太陽】sun; solar<br/>ふとい【太い】fat; thick / deep (of a voice) / daring; shameless; brazen / lucky (billiards)<br/>ふとじ【太字】boldface; bold-type; thick characters<br/>たち; だいとう【大刀】long sword<br/>ふとる【太る】to grow fat (stout, plump); to become fat; to gain weight<br/>たいようけい【太陽系】solar system<br/>たいこ【太鼓】drum<br/>たゆう【大夫】high-ranking Noh actor / head of a school of noh performance / high ranking courtesan (esp. in Yoshiwara) (Edo-period) / joruri narrator; manzai narrator / female role actor in kabuki / low ranking priest in a Shinto shrine / lord steward (formerly the fifth court rank)<br/>まるた【丸太】log<br/>ふともも; フトモモ【太もも】thigh / buttocks; arse; ass; butt<br/>たいしゅ【太守】viceroy; governor-general<br/>たいこ【太古】ancient times<br/>たいへいよう【大平洋】Pacific Ocean<br/>ふともも; フトモモ【太もも】thigh / buttocks; arse; ass; butt<br/>のぶとい【箆太い】audacious; daring; bold; impudent; cheeky / throaty (voice); rough; deep; hoarse<br/>こうたいごう; こうたいこう【皇太后】Queen Mother; Empress Dowager<br/>こうたいし【皇太子】crown prince<br/>たいようこう【太陽光】sunlight<br/>たいへい【太平】peace; tranquility; tranquillity	7	タイ, タ	ふと.い, ふと.る	120	181	3	[sound:RTK1_keyword_jp_126..mp3]	[sound:RTK1_keyword_en_126.mp3]
127	"<img src=""E599A8.png"" />"	utensil			器	うつわ	utensil	utensil, mouth, large, St. Bernard, mouth4	The picture in this kanji is not a pleasant one. It shows a large and fluffy <i>St. Bernard dog</i> stretched out on a table all stuffed and stewed and garnished with vegetables, its paws in the air and an apple in its mouth. At each corner of the table sits an eager but empty <i>mouth</i>, waiting for the <b>utensils</b> to arrive so the feast can begin.		15	Imagine four hungry mouths all sitting around the table. They are all banging their utensils on the table waiting for a big meal to be placed in the centre.	"Note: 器 by itself means container/caliber/vessel. And 食器 means eating utensils (""food container"", hehe)."	器	ぶき【武器】weapon; arms; ordnance / weapon (something used to gain an advantage); asset<br/>うつわ【器】bowl; vessel; container / ability; capacity; calibre; caliber<br/>き【器】device; instrument / vessel; container<br/>へいき【兵器】arms; weapons; ordnance<br/>じゅわき【受話器】(telephone) receiver<br/>きよう【器用】skillful; skilful; handy<br/>けいき【計器】meter; gauge<br/>きかん【器官】organ (of body, plant, etc.)<br/>きょうき【兇器】dangerous weapon; lethal weapon; deadly weapon<br/>しょっき【食器】tableware<br/>きかい【器械】machine; mechanism / instrument; appliance; apparatus<br/>ぶきよう【不器用】clumsy; awkward; unskillfulness; lack of ability / tactless; awkward (e.g. socially); gauche / mean; cowardly; base<br/>ようき【容器】container; vessel<br/>がっき【楽器】musical instrument<br/>きぐ【器具】utensil; apparatus; implement; device; gadget<br/>せいき【性器】genital<br/>きりょう【器量】looks; features; personal beauty / ability; talent; calibre; caliber; capability; capacity / dignity; credit; estimation<br/>きき【器機】device; equipment; machinery; apparatus<br/>すえき【陶器】Sue ware (type of unglazed pottery made from the middle of the Kofun era through the Heian era)<br/>とうき【陶器】porcelain (esp. soft-paste porcelain); china; chinaware; earthenware; pottery; ceramics; crockery	7	キ	うつわ	121	475	2	[sound:RTK1_keyword_jp_127..mp3]	[sound:RTK1_keyword_en_127.mp3]
128	"<img src=""E887AD.png"" />"	stinking			臭い	くさい	stinking	stinking, nose, drop, eye, large, St. Bernard	This character is a bit friendlier to the animal world. Our friend the <i>St. Bernard</i> is alive and well, its <i>nose</i> in the air sniffing suspiciously after something <b>stinking</b> somewhere or other.		9	The ST. BERNARD DOG lifted his large NOSE high in the air to find out where the stinking smell comes from.	When I is big, Ego stinking.	臭	しゅう【臭】-smell; stinking of / smacking of; hinting of<br/>におい【匂】odour; odor; scent; smell; stench / aura; whiff; smacks of ...; sense; flavour; flavor<br/>くさい【臭い】stinking; smelly / suspicious; fishy / clumsy<br/>たいしゅう【体臭】body odor; body odour; personal odor; personal odour; characteristic (of someone)<br/>しゅうき【臭気】bad smell; stink<br/>なまぐさい【生臭い】smelling of fish; fishy; smelling of blood; bloody / degenerate (of a monk); depraved; corrupt; fallen / worldly; mundane; secular; common; ordinary / fishy; suspicious; questionable<br/>いしゅう【異臭】offensive smell; off-flavor; off-flavour<br/>あくしゅう【悪臭】stink; bad odor; bad odour; stench<br/>めんどくさい; めんどうくさい【面倒くさい】bothersome; tiresome; bother to do<br/>てれくさい【照れくさい】embarrassing; awkward<br/>ふしゅう【腐臭】smell of something rotten; rotten smell<br/>あおくさい【青臭い】inexperienced; immature / grassy-smelling<br/>みずくさい【水くさい】stand-offish; distant; not frank; reserved / watery (alcohol, coffee, etc.)<br/>におう【匂う】to be fragrant; to smell (good) / to stink; to smell (bad) / to glow; to be bright / to smack of; to show hints of<br/>ふるくさい【古くさい】stale; old fashioned; hackneyed; trite<br/>うさんくさい【胡散臭い】suspicious-looking; shady; questionable; dubious; fishy<br/>きなくさい【焦臭い】burning or scorched smell / imminent military action / suspicious<br/>むしゅう【無臭】odorless; odourless; unscented<br/>こうしゅう【口臭】bad breath; halitosis<br/>ちちくさい【乳臭い】smelling of milk; green; wet behind the ears; immature	7	シュウ	くさ.い, -くさ.い, にお.う, にお.い	122	1350	1	[sound:RTK1_keyword_jp_128..mp3]	[sound:RTK1_keyword_en_128.mp3]
129	"<img src=""E59785.png"" />"	sniff			嗅ぐ	かぐ	to sniff		You have seen those scratch´n´<b>sniff</b> advertisements for perfumes. This one is for a <i>mouth</i>wash that replaces one <i>stinking</i> oder with another.		13			嗅	かぐ【嗅ぐ】to sniff; to smell<br/>きゅうかく【嗅覚】sense of smell; olfaction<br/>かぎつける【嗅ぎつける】to sniff out; to get wind of<br/>かぎだす【かぎ出す】to scent out; to detect<br/>かぎつける【嗅ぎつける】to sniff out; to get wind of<br/>かぎたばこ; かぎタバコ【嗅ぎタバコ】snuff<br/>かぎあてる【嗅ぎ当てる】to sniff out; to catch the scent of	7	キュウ	か.ぐ		1720	0	[sound:RTK1_keyword_jp_129..mp3]	[sound:RTK1_keyword_en_129.mp3]
130	"<img src=""E5A699.png"" />"	exquisite			妙	みょう	exquisite	exquisite, woman, few	"The primitive for <i>woman</i> is on the left (there and at the bottom of another primitive is where you will always find her), and to the right the element for <i>few</i>. When we refer to a <i>woman</i> as <b>exquisite</b>, we mean to praise her as the sort of person we meet but <i>few</i> and far between. If you are interested in etymologies, it might help to recall that the Latin phrase lying at the root of the English word <b>exquisite</b> carries this same sense of ""seeking out"" the rare from the ordinary."		7	Exquisite women are few and far between.	A geisha is an exquisite and delicate (another meaning of this kanji) women, however, even in the past there was only few of them.	妙	みょう【妙】strange; unusual / (something) superb; (something) excellent<br/>きみょう【奇妙】strange; queer; curious<br/>みみょう【微妙】unspeakably wonderful; sublime; exquisite; marvelous<br/>びみょう【微妙】delicate; subtle; sensitive / difficult; delicate (situation); complicated / doubtful; questionable; dicey; tricky<br/>こうみょう【巧妙】ingenious; skillful; clever; deft<br/>しんみょう; しんびょう【神妙】meek; quiet; docile; humble; faithful; obedient / mysterious; marvelous<br/>ぜつみょう【絶妙】exquisite; superb; perfect; miraculous<br/>ちんみょう【珍妙】queer; odd; fantastic<br/>しろたえ; しらたえ【白妙】white cloth / white<br/>みょうあん【妙案】ingenious idea; excellent plan; bright idea<br/>みょうれい【妙齢】young; blooming (age)<br/>せいみょう【精妙】exquisite<br/>みょうやく【妙薬】wonder drug; miracle cure; elixir<br/>けいみょう【軽妙】light and easy; lambent; facile; clever; witty; smart<br/>みょうみ【妙味】exquisite; charm; profit<br/>なむみょうほうれんげきょう【南無妙法蓮華経】Glory to the Sutra; Hail Lotus Sutra<br/>みょうほう【妙法】mysteries; excellent methods / marvelous law of Buddha; Saddharma / Lotus Sutra; teachings of the Lotus Sutra<br/>みょうぎ【妙技】exquisite skill; wonderful performance<br/>みょうちきりん【妙ちきりん】weird; odd; bizarre; curious<br/>みょうおん【妙音】exquisite voice; exquisite music	7	ミョウ, ビョウ	たえ	123	1131	1	[sound:RTK1_keyword_jp_130..mp3]	[sound:RTK1_keyword_en_130.mp3]
