179	"<img src=""E781BD.png"" />"	disaster			災害	さいがい	calamity; disaster; misfortune	disaster, stream, flood, fire	Of all of nature´s <b>disasters</b>, this kanji picks out two of the worst: <i>floods</i> and <i>fires</i>. To recall the disposition of the elements, think of nature´s solution to nature´s own problem: a great <i>flood</i> pouring down over a great forest <i>fire</i>.		7	What a disaster! First a FIRE, then on top of it came FLOODs.	Don´t know about Japan, but here in Australia, flooding rivers and bushfires are the most common natural disasters.	災	かさい【火災】conflagration; fire<br/>さいなん【災難】calamity; misfortune; disaster<br/>さいがい【災害】calamity; disaster; misfortune<br/>しんさい【震災】earthquake disaster / Great Kanto Earthquake (1923)<br/>さいやく【災厄】calamity; disaster; accident<br/>ぼうさい【防災】disaster prevention<br/>わざわい【殃】calamity; catastrophe; misfortune<br/>てんさい【天災】natural calamity; disaster<br/>だいしんさい【大震災】great earthquake (disaster) / Great Kanto earthquake of 1923<br/>せんさい【戦災】war damage<br/>ひさい【被災】being a victim of (some disaster); suffering from<br/>りさい【り災】suffering (from a calamity); affliction<br/>そくさい【息災】good health<br/>かさいほうちき【火災報知器】fire alarm (box)<br/>さいか【災禍】accident; calamity; mistake; catastrophe<br/>じんさい【人災】man-made calamity<br/>かんとうだいしんさい【関東大震災】Great Kanto earthquake of 1923<br/>へんさい【変災】accident; disaster<br/>ろうさい【労災】work-related injury; work-related illness; work-related death; on-the-job accident / workers' compensation insurance<br/>そくさいえんめい【息災延命】health and longevity; enjoying a long and healthy life being untouched by disaster	8	サイ	わざわ.い	167	707	1	[sound:RTK1_keyword_jp_179..mp3]	[sound:RTK1_keyword_en_179.mp3]
180	"<img src=""E781B0.png"" />"	ashes			灰	はい	tuhk	ashes, cliff, fire	The kanji for <b>ashes</b> naturally includes the primitive for <i>fire</i>, or more specifically, a <i>fireplace</i>. Now what do you do with that bucket of <b>ashes</b> you have just cleaned out of the <i>fireplace</i>? You walk to the edge of a <i>cliff</i> and tip it upside down, watching as they are swept away in the wind like a swarm of gray mosquitoes. Thus the <i>fire</i>, once it has turned to <b>ashes</b>, ends up at the bottom of the <i>cliff</i>.		6	The fire underneath the cliff will eventually turn everything above to ashes.	"Scene from ""The Big Lebowski"" : Walter scatters Donny´s ashes, but a wind blows much of the ashes into ""The Dude"" Lebowski´s face. Upset, The Dude lashes out at Walter. Walter apologizes and hugs The Dude, before suggesting ""Fuck it, man. Let´s go bowling."" I bet you that The Dude wanted to cremate (fire) Walter right there and then, at the top of the cliff! (thanks Elktapestry)."	灰	はいいろ【灰色】grey; gray; ashen<br/>はい【灰】ash; ashes<br/>はいざら【灰皿】ashtray<br/>せっかい; いしばい【石灰】lime; quicklime; caustic lime<br/>せっかいがん【石灰岩】limestone<br/>かいじん【灰燼】ash; embers; complete destruction<br/>あく【灰汁】lye / harsh taste; astringency / scum (formed when cooking some foods) / (excessive) strength of will<br/>ぎんかいしょく【銀灰色】silver gray; silver grey<br/>かいはくしょく【灰白色】grayish white; greyish white<br/>かざんばい【火山灰】volcanic ash<br/>こうかい; こうはい【降灰】volcanic ash<br/>はいじん【灰塵】ashes and dust<br/>はいかぐら【灰神楽】raising a cloud of ashes<br/>ぎょうかいがん【凝灰岩】tuff<br/>しのはい【死の灰】lethal radioactive fallout; atomic dust<br/>せっかいせき【石灰石】limestone<br/>かいぶん【灰分】ash / (nutritional) mineral content<br/>しかい【死灰】as lifeless as cold ashes<br/>わらばい【藁灰】straw ashes<br/>はいおとし【灰落し】ash tray; ash pit	8	カイ	はい	168	834	2	[sound:RTK1_keyword_jp_180..mp3]	[sound:RTK1_keyword_en_180.mp3]
181	"<img src=""E782B9.png"" />"	spot			時点	じてん	point in time; occasion	spot, fortune-telling, magic wand, augury, mouth, oven-fire, barbecue	If you look into the flickering of a <i>fire</i> for a long time and then turn aside, you will see <b>spots</b> before your eyes. Although nobody ever thought of such a thing before - as least as far as know, they didn´t - imagine using those <b>spots</b> as a technique for <i>fortune-telling</i>. The old witch sits before her <i>cauldron</i> and watches the <b>spots</b> that show up when she turns to look at you, and from that <i>tells your fortune</i>. Think of it as a kind of <b>spot</b>-check on your future.		9	The FORTUNE TELLER was burned by FLAMES on the spot because she was accused of being a witch.	You have to stimulate the G-spot with your magic wand in order to get her on fire. Or you can juste use your mouth...	点	じてん【時点】point in time; occasion<br/>ちてん【地点】site; point on a map; spot<br/>だくてん【濁点】voiced consonant marks (nigori)<br/>てんけん【点検】inspection; examination; checking<br/>しょうてん【焦点】focus (e.g. photographic); focal point<br/>ちょうてん【頂点】top; summit<br/>じゃくてん【弱点】weak point; weakness; shortcoming; defect; flaw; sore spot; tender spot<br/>こうてん【光点】luminous point<br/>がてん; がってん【合点】consent; assent; understanding; agreement; comprehension; grasp<br/>けってん【欠点】fault; defect; flaw; weak point; weakness; shortcoming; drawback / failure (in an examination); failing grade<br/>してん【視点】opinion; point of view; visual point<br/>つく【点く】to be lit (e.g. electricity comes on); to be lighted / to catch fire<br/>とぼし【灯】light; lamp<br/>てんか【点火】ignition; lighting; set fire to<br/>てんめつ【点滅】switching on and off; flashing; blinking; flickering<br/>きょてん【拠点】position; location; base; point<br/>てんてん【点々】here and there; little by little; sporadically; scattered in drops; dot; spot<br/>こうさてん【交叉点】crossing; intersection<br/>せってん【切点】tangent point; point of contact / contact (electrical, etc.) / point of agreement; common ground; interaction<br/>てんざい【点在】dotted with	8	テン	つ.ける, つ.く, た.てる, さ.す, とぼ.す, とも.す, ぼち	169	196	2	[sound:RTK1_keyword_jp_181..mp3]	[sound:RTK1_keyword_en_181.mp3]
182	"<img src=""E785A7.png"" />"	illuminate			照らす	てらす	illuminate, shine on	illuminate, shining, sun, day, summon, seduce, sword, dagger, mouth, oven-fire, barbecue	Although the range of possible meanings that the kanji for <b>illuminate</b> can have is about as rich as the connotations of the English word, we need to focus on just one of them: to make something <i>shine</i>. If you glaze a pot and put it into the <i>oven</i> to <i>fire</i> it, you in fact <i>illuminate</i> it. Hence the kanji for <b>illuminate</b> compares the kanji for <i>shining</i> with the primitive element for the <i>oven´s fire</i>.		13	SHINING FLAMES illuminate!	The sun was seduced to give us fire, by which we illuminate the night.	照	てらす【照らす】to shine on; to illuminate / to compare (with); to refer to<br/>しょうめい【照明】illumination; lighting<br/>てれる【照れる】to be shy; to be bashful; to feel awkward; to feel embarrassed<br/>しょうじゅん【照準】sight (e.g. of a gun); aim; alignment<br/>たいしょう【対照】contrast; antithesis; comparison<br/>ほてる【火照る】to feel hot; to flush; to burn<br/>てる【照る】to shine / to look slightly upward (of a noh mask; indicating joy, etc.)<br/>てれくさい【照れくさい】embarrassing; awkward<br/>しょうごう【照合】collation; comparison<br/>てりつける【照りつける】to blaze down on; to beat down on; to shine down upon<br/>てりかえす【照り返す】to reflect; to throw back light<br/>さんしょう【参照】reference; bibliographical reference; consultation; browsing (e.g. when selecting a file to upload on a computer); checking out<br/>てれかくし【照れ隠し】hiding one's embarrassment<br/>にっしょう【日照】sunlight<br/>しょうかい【照会】inquiry; enquiry; query; reference<br/>ともし【灯】light; lamp / baiting deer with a lighted torch<br/>しょうしゃ【照射】exposure<br/>てれ【照れ】abashment; bashfulness<br/>てれくさい【照れくさい】embarrassing; awkward<br/>てり【照り】sunshine; dry weather; luster; lustre	8	ショウ	て.る, て.らす, て.れる	170	541	2	[sound:RTK1_keyword_jp_182..mp3]	[sound:RTK1_keyword_en_182.mp3]
183	"<img src=""E9AD9A.png"" />"	fish			魚	さかな	fish	fish, bound up, rice field, brains, oven-fire, barbecue	The composition of this kanji shows three elements, which we list in the order of their writing: <i>bound up</i> . . . <i>rice field</i> . . . <i>cooking fire</i>. Not much to work with at first sight. But we can join them together by thinking of a three-part story: first a <b>fish</b> is caught and <i>bound up</i> on a line with its unfortunate school-mates; when the fisherman gets home, he cuts off the head and tosses it, with the entrails, out into the <i>rice fields</i> for fertilizer; and the rest he sets in a skillet over a <i>cooking fire</i> for his supper.		11	The elements of this kanji are bound up, rice field and cooking fire. When I think of bound up cooked rice, it makes me think of sushi, which in turn brings to mind fish.	Bind that FISH and cook his brains! Yarhh!	魚	さかな; うお【魚】fish<br/>ぎょらい【魚雷】torpedo<br/>きんぎょ【金魚】goldfish<br/>にんぎょ【人魚】mermaid; merman<br/>さかなや【魚屋】fish market; fish dealer<br/>しらうお; シラウオ【白魚】icefish (Salangidae spp., esp. the Japanese icefish, Salangichthys microdon); noodlefish; whitebait<br/>しろうお; シロウオ【白魚】ice goby (Leucopsarion petersii)<br/>ざこ; じゃこ; ざっこ; ざっこう; いざこ; ざこう【雑喉】small fish; small fry / person of low social standing<br/>さんま; サンマ【秋刀魚】Pacific saury (Cololabis saira); mackerel pike<br/>ぎょるい【魚類】fish; fishes<br/>もくぎょ【木魚】fish gong; fish wood block; temple block; round, hollow, wood block (vaguely fish-shaped, usu. with scales), struck while chanting sutras<br/>しんかいぎょ【深海魚】deep-sea fish<br/>やきざかな【焼き肴】grilled fish<br/>さかなつり; うおつり; いおつり【魚つり】fishing<br/>とびうお; トビウオ【飛魚】flying fish (esp. the Japanese flying fish, Cypselurus agoo)<br/>うおがし【魚河岸】riverside fish market<br/>ぎょぐん【魚群】school of fish<br/>うおいちば【魚市場】fish market<br/>ぎょにく【魚肉】fish meat<br/>せいぎょ; なまざかな; なまうお【生魚】raw or fresh fish	8	ギョ	うお, さかな, -ざかな	171	109	4	[sound:RTK1_keyword_jp_183..mp3]	[sound:RTK1_keyword_en_183.mp3]
184	"<img src=""E6BC81.png"" />"	fishing			漁	りょう　【漁】	fishery; fishing	fishing, water, water droplets, water pistol, fish, bound up, rice field, brains, oven-fire, barbecue	To the story we have just made about <i>fish</i>, this kanji for the profession of <b>fishing</b> adds yet another element BEFORE the others: namely the <i>water</i>, where the fish was happily at home before being caught, disemboweled, and eaten. Be sure to get a clear image of the <i>water</i> when you put it all together.		14	You need WATER and FISH for fishing.	If you are confusing this with angling like me, take fishing to mean not the act of catching a fish but the act of being a fish not living but fishing (i.e. in the water).	漁	りょうし【漁師】fisherman<br/>すなどり【漁】fishing; collecting shells / fisherman<br/>りょう【漁】fishing; gathering seafood (e.g. clams, seaweed) / catch (e.g. of fish); haul<br/>ぎょふ【漁夫】fisherman<br/>ぎょせん【漁船】fishing boat<br/>ぎょそん【漁村】fishing village<br/>あさる; すなどる; いさる【漁る】to fish / to look for; to search for; to hunt for; to scavenge; to scrounge; to look through; to rummage through<br/>ぎょぎょう【漁業】fishing (industry)<br/>たいりょう【大漁】big catch<br/>ぎょじょう; ぎょば; りょうば【漁場】fishing grounds; permitted fishing zone<br/>ぎょこう【漁港】fishing harbour; fishing harbor<br/>ぎょみん【漁民】fishermen<br/>あさり【漁り】searching; rummaging / fishing; collecting shells<br/>すなどり【漁】fishing; collecting shells / fisherman<br/>ぎょかく【漁獲】fishing; catch; haul<br/>ぎょしょく【漁色】lechery; debauchery; philandering<br/>ぎょか【漁火】fire for luring fish at night<br/>いさりび【漁火】fire for luring fish at night<br/>しゅつぎょ; しゅつりょう【出漁】going fishing<br/>ぎょきょう【漁協】fishery cooperative	8	ギョ, リョウ	あさ.る	172	483	2	[sound:RTK1_keyword_jp_184..mp3]	[sound:RTK1_keyword_en_184.mp3]
185	"<img src=""E9878C.png"" />"	ri			古里	ふるさと		ri, computer, rice field, brains, soil, dirt, ground	"That´s right - a <b><i>ri</i></b>. Don´t bother looking it up in your English dictionary; it´s a Japanese word for measuring distances. One <b><i>ri</i></b> is about 4 kilometers or 2.5 miles. The kanji depicts how the measure came to be used. Atop we see the <i>rice field</i>, and below the element for <i>land</i>. Those four sections you see in the <i>rice field</i> (and which we made mention of when first we introduced the character in frame 14) are actually measurements of <i>land</i>, much the same as farm-sections in the United States have given us the notion of a ""country mile."" The <i>land</i> division based on the size of a <i>rice field</i> is called a <b><i>ri</i></b>."	"* To get a more concrete primitive meaning for this kanji, we shall refer to it as a <i>computer</i>, a meaning deriving from the kanji for <i>logic</i>, which we will meet in Lesson 12.	 "	7	The ri is a Japanese way of measuring the area of the GROUND underneath a RICE FIELD.	Hint: Heisig makes here a severe disservice to everyone by using a weird keyword for this character. You´ll save a lot (and I mean, a whole lot) of trouble later by giving it instead its intended meaning: House of the Parents.	里	さと【郷】village; hamlet / countryside; country / home (of one's parents, etc.); hometown / one's origins; one's upbringing; one's past<br/>り【里】Japanese league; ri; old Japanese unit of distance, approx. 3.927km or 2.44 miles / neighbourhood (under the ritsuryo system; orig. of 50 homes) / unit of area (approx. 654m by 654m)<br/>パリ【巴里】Paris (France)<br/>さとご【里子】foster child<br/>きょうり【郷里】birth-place; home town<br/>せんり【千里】1000 ri; (a) long distance<br/>おさと【御里】one's parents' home / one's origins; one's upbringing; one's past<br/>ばんり【万里】thousands of miles<br/>ひとざと【人里】human habitation<br/>やまざと【山里】mountain hamlet (village)<br/>せんりがん【千里眼】clairvoyance<br/>さとびと; りじん【里人】villager; village folk; countryfolk<br/>さとがえり【里帰り】returning home; visiting one's parents; new bride's first visit to parents<br/>さといも; サトイモ【里芋】taro (Colocasia esculenta); dasheen; eddo<br/>さとごころ【里心】homesickness; nostalgia<br/>かり【加里】potassium / potash<br/>ごりむちゅう【五里霧中】totally at a loss; lose one's bearings; in a maze; in a fog; all at sea; up in the air; mystified; bewildered<br/>さとかた【里方】wife's family<br/>むらざと【村里】village<br/>ゆうり【遊里】red light district	9	リ	さと	173	238	1	[sound:RTK1_keyword_jp_185..mp3]	[sound:RTK1_keyword_en_185.mp3]
186	"<img src=""E9BB92.png"" />"	black			黒い	くろい	black	black, computer, oven-fire, barbecue	Like most things electrical, a <i>computer</i>, too, can overheat. Just imagine <i>flames</i> pouring out of it and charring the keyboard, the monitor, and your desk a sooty <b>black</b> color.		11	If you burn the GROUND of a RICE FIELD with FIRE, eventually it will turn black.	If your parent´s home catches on fire, it will turn black.	黒	くろ【黒】black / black go stone / guilt; guilty person<br/>あんこく【暗黒】darkness<br/>くろかみ; こくはつ【黒髪】black hair<br/>くろご; くろこ【黒子】stage assistant dressed in black (in kabuki); stagehand; prompter / behind-the-scenes supporter; string-puller<br/>こくい; こくえ; くろぎぬ【黒衣】black clothes<br/>しっこく【漆黒】jet black<br/>まっくろ【真黒】pitch black<br/>あかぐろい【赤黒い】dark red; dark brown; reddish brown<br/>こくじん【黒人】black person / woman in the nightlife business; demimondaine; geisha and prostitutes<br/>くろうと; くろと【玄人】expert; professional; master / woman in the nightlife business; demimondaine; geisha and prostitutes<br/>こくばん【黒板】blackboard<br/>しろくろ【白黒】black and white; monochrome / good and evil; right and wrong; guilt and innocence<br/>どすぐろい【どす黒い】darkish; dusky<br/>くろずむ【黒ずむ】to blacken; to darken<br/>あさぐろい【浅黒い】darkish; swarthy<br/>まっくろ【真黒】pitch black<br/>くろっぽい【黒っぽい】dark; blackish<br/>くろびかり【黒光り】black lustre; black luster<br/>あおぐろい【蒼黒い】black with hints of blue (as in a bruise); bluish black<br/>こくしょく【黒色】black (colour, color)	9	コク	くろ, くろ.ずむ, くろ.い	174	137	3	[sound:RTK1_keyword_jp_186..mp3]	[sound:RTK1_keyword_en_186.mp3]
187	"<img src=""E5A2A8.png"" />"	black ink			墨	すみ	must tušš	black ink, black, computer, oven-fire, barbecue	Besides meaning <b>black ink</b>, this kanji also appears in the word for an inked string that is pulled taut and snapped to mark a surface, much the same as one might used a chalked string. Here it is used to mark off the <i>dirt</i> with <i>black</i> lines for a foot ballgame (played, I presume, on a white field).		14	Theres BLACK on the GROUND...most likely someone spilt some black ink.	Anyone who has worked with laserjet ink cartridges will know the black ink looks like powdered dirt.	墨	ぼく【墨】Mexico<br/>すみ【墨】sumi; India ink; Chinese ink; ink stick; ink-cake / squid ink; octopus ink / carpenter's inking string<br/>うすずみ【薄墨】thin or diluted ink<br/>いれずみ; しせい; ぶんしん; げい【入墨】tattoo<br/>すみいろ【墨色】ink black<br/>はくぼく【白墨】blackboard chalk<br/>いれずみ; しせい; ぶんしん; げい【入墨】tattoo<br/>ぼくじゅう【墨汁】India ink; China ink / ink (of a cuttlefish, etc.)<br/>おすみつき【お墨付き】handwriting; autograph; authorization; authorisation / certificate; certified document; paper with signature of the shogun or lord<br/>すみえ【墨絵】ink painting<br/>ぼっこん【墨痕】ink marks; handwriting<br/>ぼくしゅ【墨守】adherence (to custom, tradition)<br/>すいぼく【水墨】water and ink / ink painting<br/>すみぞめ【墨染め】dying black; dyeing black; dyed black; dark<br/>なべずみ【鍋墨】soot on the bottom of a pot or pan<br/>くつずみ【靴墨】shoe polish<br/>まゆずみ【眉墨】eyebrow pencil / blackened eyebrows / (metaphorically) distant mountain range<br/>ぼくしょ【墨書】writing in India ink<br/>ぼっかく; ぼっきゃく【墨客】artist; writer<br/>ぼくが【墨画】India-ink drawing	9	ボク	すみ	175	1831	1	[sound:RTK1_keyword_jp_187..mp3]	[sound:RTK1_keyword_en_187.mp3]
188	"<img src=""E9AF89.png"" />"	carp			鯉	こい	common carp (Cyprinus carpio); koi carp	carp, fish, bound up, rice field, brains, oven-fire, barbecue, computer	"These are the same <b>carp</b> you see in Japanese ""<b>carp</b> streamers."" Only here we find a small home <i>computer</i> or two strung on the line by a father anxious for his son not only to have the courage and determination of a <b>carp</b> swimming upstream, but also the efficiency and memory of a <i>computer</i>. Ugh."		18	Japanese carp are massive fish - they are measured in ri!	The fish got carpal tunnel syndrome from the computer(I know it´s lame but it´s hard to find a good story for this).	鯉	こい; コイ【鯉】common carp (Cyprinus carpio); koi carp<br/>こいぐち【鯉口】mouth of a (sword) sheath<br/>ひごい【緋鯉】red carp; golden carp<br/>にしきごい【錦鯉】coloured carp; colored carp<br/>まごい【真鯉】black carp; black koi<br/>こいのぼり【鯉のぼり】carp streamer; carp banner	9	リ	こい	176		1	[sound:RTK1_keyword_jp_188..mp3]	[sound:RTK1_keyword_en_188.mp3]
189	"<img src=""E9878F.png"" />"	quantity			量る	はかる	kaaluma	quantity, nightbreak, sun, day, one, floor, computer	Think of <b>quantity</b> as having to do with measuring time and distance, and the rest is simple: you have a quantity of time in the new day that begins with <i>nightbreak</i>, and a quantity of distance in the rural <i>ri</i>.		12	I did such a quantity of work that when NIGHT BREAK came, I was asleep on the COMPUTER.	If you find that by nightbreak, you´re still playing at your computer, chances are your World of Warcraft character has a high quantity of levels. [thanks to ssmoler] ..... To remember that nightbreak appears ABOVE computer, think of looking UP from your computer at the window to realize you´ve been playing until nightbreak.	量	りょう【量】quantity; amount; volume; portion (of food)<br/>はか【捗】progress<br/>たいりょう【大量】large quantity; massive (quantity); mass (e.g. mass production, mass transit, mass destruction)<br/>じゅうりょう【重量】weight / heavyweight boxer<br/>しつりょう【質量】mass<br/>きりょう【器量】looks; features; personal beauty / ability; talent; calibre; caliber; capability; capacity / dignity; credit; estimation<br/>たりょう【多量】large quantity<br/>りきりょう【力倆】ability; capacity; capability; talent / physical strength<br/>ぎりょう【伎倆】ability; competency; talent; skill; capacity<br/>おんりょう【音量】volume (sound)<br/>すいりょう【推量】guess<br/>ぶんりょう【分量】amount; quantity<br/>りょうさん【量産】mass production<br/>りょうかん【量感】voluminous; massive; bulky<br/>ようりょう【容量】capacity; volume / capacitance<br/>そくりょう【測量】measurement; surveying<br/>しょうりょう【小量】small dose; small quantity; narrowmindedness<br/>どりょう【度量】generosity; magnanimity; tolerance / length and capacity; measures<br/>りょうてき【量的】substantively<br/>すいりょう【水量】quantity or volume of water	9	リョウ	はか.る	177	630	2	[sound:RTK1_keyword_jp_189..mp3]	[sound:RTK1_keyword_en_189.mp3]
190	"<img src=""E58E98.png"" />"	rin			一厘	いちりん		rin, cliff, computer	"No doubt you will find it in your heart to forgive me for forcing yet another Japanese word on you in this frame. It is not the last time it will happen in this book, but I can assure you they are used only when absolutely necessary. One <b><i>rin</i></b> is equal to about 1/1000 of a yen - or rather was worth that much when it still made economic sense to mint them. While inflation took its toll on this kanji as a monetary unit, it survived with the not at all surprising sense of something ""very, very tiny."" The kanji shows a <i>cliff</i> with a <i>computer</i> under it, apparently because it has been pushed over into the abyss by someone fed up with the thing. The total market value of one home <i>computer</i> that has fallen over rock and bramble for several hundred feet: about one <b><i>rin</i></b>!"		9	I threw my Rindows computer off a cliff because it kept crashing. Now, after its last crash, it´s worth less than a rin.	A computer dropped off of a cliff would be worth about 1 RIN.	厘	りん【厘】one-hundredth; 0.3 mm (one-hundredth of a sun); 0.1 percent (one-hundredth of a wari); 0.0375 grams (one-hundredth of a monme) / old monetary unit (0.001 yen)<br/>くぶくりん【九分九厘】ten to one; nine cases out of ten<br/>いちぶいちりん【一分一厘】(not even) a bit of; (not even) a hint of; (not) an iota of<br/>しちりん【七厘】earthen charcoal brazier (for cooking)	9	リン		178	1279	1	[sound:RTK1_keyword_jp_190..mp3]	[sound:RTK1_keyword_en_190.mp3]
