60	"<img src=""E8B2BC.png"" />"	post a bill			貼る	はる	to paste; to link	affix, shellfish, clam, oyster, eye, animal legs, eight, fortune-telling, magic wand, augury, mouth	The key word in this frame has do with <b>posting bills</b> to a billboard. In this case, the billboard is standing at the exit to a Chinese restaurant displaying the latest alternative to the tradition <i>fortune-telling</i> cookies. Look closely and you will see rows of leftover shells of <i>clams</i> with little slips of paper sticking out of them <b>posted</b> to the billboard.		12	Fortune teller writes your fortune on a piece of paper and tells you to affix it to a shell and throw into the ocean for it to come true. Picture licking the back of the shell like a stamp and affixing it to the fortune.	I gots a fix for your current bad luck: just pass some extra clams over to the fortune teller, and they will make sure you have a very bright fate instore.	貼	はる【張る】to stick; to paste; to affix / to stretch; to spread; to strain; to tighten; to put up (tent) / to form (e.g. ice on a pond) / to fill; to swell / to stick out; to put; to slap / to be expensive / to keep a watch on; to be on the lookout / to become one tile away from completion<br/>はりがみ【張紙】paper patch; paper backing; poster; sticker; label<br/>はりがみ【張紙】paper patch; paper backing; poster; sticker; label<br/>きりばり【切り張り】patching (up); cutting a part and pasting a new one (e.g. a shoji door) / cut and paste<br/>ちょうふ; てんぷ【貼付】pasting; sticking; attaching; affixing; appending<br/>めばり【目張り】weather stripping / putting on eyeliner<br/>きりばり【切り張り】patching (up); cutting a part and pasting a new one (e.g. a shoji door) / cut and paste<br/>うわばり【上貼り】finishing coat of paper	4	テン, チョウ	は.る, つ.く	2736	1701	0	[sound:RTK1_keyword_jp_60.mp3]	[sound:RTK1_keyword_en_60.mp3]
61	"<img src=""E8A68B.png"" />"	see			見る	みる	vaatama	see, eye, human legs	The elements that compose the character for <b>see</b> are the <i>eye</i> firmly fixed to a pair of <i>human legs</i>. Surely, somewhere in your experience, there is a vivid image just waiting to be dragged up to help you remember this character....		7	As a primitive, this is Mike Wazowski from Monsters Inc. (the giant eyeball with legs...) Makes for easy stories later on.	Eyes and legs are all you need to see the world.	見	みつける; みっける【見つける】to discover; to find (e.g. an error in a book); to come across; to detect; to spot / to locate; to find (e.g. something missing); to find fault / to be used to seeing; to be familiar with<br/>みあげる【見あげる】to look up at; to raise one's eyes / to look up to; to admire; to respect<br/>はっけん【発見】discovery; detection; finding<br/>みつかる【見つかる】to be found; to be discovered<br/>いけん【意見】opinion; view; comment<br/>みおろす【見おろす】to overlook; to command a view of; to look down on / to despise; to look down on<br/>みごと【美事】splendid; magnificent; beautiful; admirable / praiseworthy act; feat; commendable deed / utter (esp. defeat); total; complete<br/>みまわす【見まわす】to look around; to survey<br/>みおくる【見送る】to see someone off (at a station, an airport, etc.); to escort (e.g. home) / to follow something with one's eyes until it is out of sight / to let pass; to pass up (an opportunity etc.); to let a pitch go by (baseball); to watch a batted ball go into the stands / to shelve (a plan etc.); to postpone / to have someone related or close to you die; to bury someone / to take care of somebody until he dies / to wait and see; to continue (e.g. in legal contexts)<br/>みまもる【目戍る】to watch over; to watch attentively<br/>みひらく【見開く】to open one's eyes wide<br/>けんとう【見当】aim; mark; estimate; guess; approximation; direction<br/>みやる【見やる】to look at; to gaze; to stare at<br/>けんぶつ【見物】sightseeing; watching; viewing / sightseer; watcher; spectator<br/>みもの【見もの】sight; attraction; spectacle; something worth seeing<br/>みあわせる【見合せる】to exchange glances; to look at each other / to postpone; to suspend operations; to refrain from performing an action<br/>みかける【見かける】to (happen to) see; to notice; to catch sight of<br/>みわたす【見わたす】to look out over; to survey (scene); to take an extensive view of<br/>いっけん【一見】look; glimpse; glance / to glance; to glimpse / apparently; seemingly / first meeting<br/>いちげん【一現】first visit to inn, restaurant, etc. without an introduction	4	ケン	み.る, み.える, み.せる	57	20	4	[sound:RTK1_keyword_jp_61..mp3]	[sound:RTK1_keyword_en_61.mp3]
62	"<img src=""E58590.png"" />"	newborn babe			児	じ	newborn babe	newborn babe, olden times, stick, sun, day, human legs	"The top part of the kanji in this frame, you will remember, is the character for <i>olden times</i>, those <i>days</i> so old they needed a <i>walking stick</i> to get around. Western mythical imagination has old ""Father Time"" leaning on his sickle with a <b>newborn babe</b> crawling around his <i>legs</i>, the idea being that the circle of birth and-death goes on. This is the first of three times that the kanji for <i>olden times</i> will appear as a primitive element in another kanji, so try to make the most of it."		7	In the olden times, a newborn babe came out legs first.	Only 18 and already got a newborn babe. Young girls are so quick to spread their legs these days...　　　RTK2:　ジ　児童　じどう　(child)　　　　　　　　　　　　　　　　　　　　　　ニ　小児　しょうに(infant).	児	こ【児】child / young (animal) / young woman; young geisha / offshoot / interest / new shares / player who is not a dealer (in cards, mahjong, etc.) / bird egg / -er (often of young women)<br/>やや; ややこ【児】baby; child<br/>じ【児】child; boy / I; me<br/>ようじ【幼児】infant; baby; child / child over 1 but not yet of school age<br/>じどう【児童】children; juvenile<br/>こじ; みなしご【みなし子】orphan<br/>たいじ【胎仔】fetus; foetus; embryo; unborn child<br/>いくじ【育児】childcare; nursing; upbringing<br/>そうせいじ【双生児】twins<br/>しょうに; しょうじ【小児】young child; infant<br/>だんじ【男児】boy; son; man<br/>たくじ【託児】childcare; day care<br/>じょじ【女児】baby girl; primary schoolgirl<br/>へこおび【兵児帯】waist band<br/>にゅうじ【乳児】infant (below 1 years old); suckling baby<br/>もんだいじ【問題児】problem child<br/>えいじ; みどりご【嬰児】infant; baby<br/>やや; ややこ【児】baby; child<br/>ちご【稚児】(festivity) page / baby; child / boys kept by pederasts<br/>しょうにか【小児科】pediatrics	4	ジ, ニ, ゲイ	こ, -こ, -っこ	58	526	2	[sound:RTK1_keyword_jp_62.mp3]	[sound:RTK1_keyword_en_62.mp3]
63	"<img src=""E58583.png"" />"	beginning			元	もと	origin; beginning	beginning, two, human legs	"""In the <b>beginning</b>..."" starts that marvelous shelf of books we call the Bible. It talks about how all things were made, and tells us that when the Creator came to humanity she made <i>two</i> of them, man and woman. While we presume she made <i>two</i> of every other animal as well, we are not told as much. Hence we need only <i>two</i> and a pair of <i>human legs</i> come to the kanji that means <b>beginning</b>."		4	In the beginning were just two who walked on human legs.	"In the beginning God created woman, and God asked her how she liked his work. Woman replied, ""Well, you know how I have two eyes, two arms, two legs... it seems redundant to have three breasts. It would look more symmetrical with two."" God nodded, and the middle breast fell off... and it was good. Woman picked up the breast and said, ""Thank you, God! But what do I do with this useless boob?"" And God created man. That´s why the women today only have two boobs to match their two human legs."	元	"もと【元】origin; source / base; basis; foundation; root / cause / ingredient; material / (somebody's) side; (somebody's) location / original cost (or capital, principal, etc.) / (plant) root; (tree) trunk / first section of a waka / counter for blades of grass, tree trunks, etc., and for falcons (in falconry) / handle (chopsticks, brush, etc.); grip<br/>もと【元】former; ex-<br/>げん【元】unknown (e.g. in an equation) / element (of a set) / yuan (monetary unit of China) / Yuan dynasty (China)<br/>げんき【元気】lively; full of spirit; energetic; vigorous; vital; spirited / healthy; well; fit; in good health<br/>あしもと; そっか【足もと】at one's feet; underfoot; one's step (as in ""watch your step"") / gait; pace; step / most recent; current / you; thou<br/>くちもと【口もと】mouth; lips / shape of the mouth / near an entrance; vicinity of an entrance<br/>こんげん; ねもと; こんぽん【根元】root; source; origin; foundation; base; principle<br/>みみもと【耳もと】close to the ear; into someone's ear<br/>むなもと【胸もと】breast; chest / pit of the stomach; solar plexus; epigastrium<br/>てもと【手もと】at hand; on hand; nearby; close at hand / way of moving one's arms; skill / money at hand; pocket money / grip; handle<br/>じげん【次元】dimension / perspective; point of reference; level (of something)<br/>もともと【元々】originally; by nature; from the start<br/>がんらい【元来】originally; primarily; essentially; logically; naturally<br/>じもと【地元】home area; home town / local<br/>まくらもと【枕もと】bedside; near one's pillow<br/>みもと【身もと】person's identity; ID; past; background<br/>のどもと【喉元】throat<br/>もとどおり【元どおり】as before; as ever<br/>げんすい【元帥】(field) marshal; (fleet) admiral; general of the army<br/>がんねん【元年】first year (of a specific reign)"	4	ゲン, ガン	もと	59	117	3	[sound:RTK1_keyword_jp_63.mp3]	[sound:RTK1_keyword_en_63.mp3]
64	"<img src=""E9A081.png"" />"	page			頁	ページ	page	page, one, ceiling, drop, shellfish, clam, oyster, eye, animal legs, eight	"What we have to do here is turn a <i>shellfish</i> into a <b>page</b> of a book. The <i>one</i> at the top tells us that we only get a rather short book, in fact only <i>one</i> <b>page</b>. Imagine a title printed on the shell of an <i>oyster</i>, let us say ""Pearl of Wisdom,"" and then open the quaint book to its <i>one</i> and only <b>page</b>, on which you find a single, radiant <i>drop of</i> wisdom, one of the masterpiece poems of nature."	"* As a primitive, this kanji takes the unrelated meaning of a <i>head</i> (preferably one detached from its body), derived from the character for <i>head</i> (Frame 1549).	 "	9	A shellfish carrying a page balanced on its head.	One drop of ink from a shellfish can fill a whole page.	頁	"ページ【頁】page<br/>おおがい【大貝】kanji ""big shell"" radical<br/>けつがん【頁岩】shale"	4	ケツ	ぺえじ, おおがい, かしら	60		0	[sound:RTK1_keyword_jp_64.mp3]	[sound:RTK1_keyword_en_64.mp3]
65	"<img src=""E9A091.png"" />"	stubborn			頑	がん	stubborn, obstinate	stubborn, beginning, two, human legs, head, page, one, ceiling, drop, shellfish, clam, oyster, eye, animal legs, eight	"This character refers to the block<i>headed</i>, persistent <b>stubbornness</b> of one who sticks to an idea or a plan just the way it was at the <i>beginning</i>, without letting anything that comes up along the way alter things in the least. The explanation makes ""sense,"" but is hard to remember because the word ""<i>beginning</i> ""is too abstract. Back up to the image we used two frames ago - Adam and Eve in their Eden - and try again: The root of all <b>stubbornness</b> goes back to the <i>beginning</i>, with two brothers each <b>stubbornly</b> defending his own way of life and asking their God to bless it favorably. Abel stuck to agriculture, Cain to animal-raising. Picture these two with their giant, swelled <i>heads</i>, each vying for the favors of heaven, a <b>stubborn</b> grimace on their faces. No wonder something unfortunate happened!"		13	A stubborn person in the beginning gets something into their head and can´t change their mind.	Picture a STUBBORN schoolboy, with his arms crossed and his book still open to the BEGINNING PAGE. Despite the teacher telling him to turn the page, he refuses and keeps his book on the BEGINNING PAGE.	頑	がんばる【頑張る】to persevere; to persist; to keep at it; to hang on; to hold out; to do one's best / to insist that; to stick to (one's opinion) / to remain in a place; to stick to one's post; to refuse to budge<br/>がんじょう【岩乗】solid; firm; stout; burly; strong; sturdy<br/>がんこ【頑固】stubbornness; obstinacy<br/>がんきょう【頑強】stubborn; dogged; persistent; tenacious / tough; sturdy; hardy; strong<br/>がんとして【頑として】firmly, stubbornly<br/>がんけん【頑健】robust health; able-bodied<br/>がんめい【頑冥】bigotry; stubbornness; obstinacy<br/>がんばり【頑張り】tenacity; endurance<br/>がんめい【頑冥】bigotry; stubbornness; obstinacy<br/>たむし; タムシ【田虫】ringworm (of the body); tinea corporis<br/>がんぐ【頑愚】obstinate and foolish<br/>がんせん【頑癬】ringworm (of the groin); jock itch; tinea cruris	4	ガン	かたく	61	1825	1	[sound:RTK1_keyword_jp_65.mp3]	[sound:RTK1_keyword_en_65.mp3]
66	"<img src=""E587A1.png"" />"	mediocre			平凡	へいぼん	mediocre; ordinary	mediocre, drop, wind	"While we refer to something insignificant as a ""<i>drop</i> in the bucket,"" the kanji for <b>mediocre</b> suggests the image of a ""<i>drop</i> in the <i>wind</i>."""		3	A drop of breeze is naught but a mediocre wind.	Is there anything as mediocre as a drop of piss in the wind?	凡	へいぼん【平凡】common; commonplace; ordinary; mediocre<br/>すべて【全て】everything; all; the whole / entirely; completely; wholly; all<br/>ぼんじん; ぼんにん【凡人】ordinary person; average person; mediocre<br/>ぼんよう【凡庸】mediocre; banality; commonplace<br/>ひぼん【非凡】prodigy; rare; unique; extraordinary<br/>およそ【凡そ】about; roughly; approximately / generally; on the whole; as a rule / completely; quite; entirely; altogether; totally; not at all (with neg. verb) / outline; gist<br/>おおよそ【凡】about; roughly; approximately / generally; on the whole; as a rule / completely; quite; entirely; altogether; totally; not at all (with neg. verb) / outline; gist<br/>ぼんぞく【凡俗】mediocrity; the masses; ordinary run of men<br/>ぼんぷ; ぼんぶ【凡夫】ordinary person / prthag-jana (unenlightened person)<br/>おおよそ【凡】about; roughly; approximately / generally; on the whole; as a rule / completely; quite; entirely; altogether; totally; not at all (with neg. verb) / outline; gist<br/>ぼんたい【凡退】out in 1-2-3 order<br/>へいへいぼんぼん【平々凡々】very ordinary; mediocre; all-too-common; quite commonplace<br/>ぼんひゃく; ぼんぴゃく【凡百】many; many kinds<br/>ぼんぐ【凡愚】common person; foolish commoner<br/>ちょうぼん【超凡】extraordinary<br/>ぼんさい【凡才】mediocrity; ordinary ability<br/>ぼんりょ【凡慮】ordinary minds; ordinary men<br/>ぼんがん【凡眼】(through) a layman's eyes<br/>ぼんこつ【凡骨】ordinary person<br/>ぼんだ【凡打】poor batting	4	ボン, ハン	およ.そ, おうよ.そ, すべ.て	62	1014	1	[sound:RTK1_keyword_jp_66.mp3]	[sound:RTK1_keyword_en_66.mp3]
67	"<img src=""E8B2A0.png"" />"	defeat			負ける	まける	to lose; to be defeated	defeat, bound up, shellfish, clam, oyster, eye, animal legs, eight	Above we have the condensed form of <i>bound up</i>, and below the familiar <i>shellfish</i>. Now imagine two <i>oysters</i> engaged in <i>shell</i>-to-<i>shell</i> combat, the one who is <b>defeated</b> being <i>bound and gagged</i> with seaweed, the victor towering triumphantly over it. The <i>bound shellfish</i> thus becomes the symbol for <b>defeat</b>.		9	Tied up, the shellfish had to accept defeat!	Defeat is defined by a shellfish in binds.	負	まける【敗ける】to lose; to be defeated / to succumb; to give in; to surrender; to yield / to be inferior to / to break out in a rash due to (e.g. lacquer, shaving, etc.) / to reduce the price; to lower the price; to give a discount on<br/>しょうぶ【勝負】victory or defeat; match; contest; game; bout<br/>せおう; しょう【背負う】to be burdened with; to take responsibility for; to carry on back or shoulder / to have (something) in the background; to be in front (of something)<br/>おう【負う】to bear; to carry on one's back / to take responsibility for; to accept a duty / to be injured / to owe<br/>ふしょう【負傷】injury; wound<br/>まけ【負け】defeat; loss; losing (a game)<br/>おい【笈】wooden box carried on one's back to store items for a pilgrimage<br/>ふ【負】negative; minus<br/>ふたん【負担】burden; charge; responsibility<br/>じふ【自負】conceit; bragging about one's own ability<br/>おえる【負える】to be able to bear; to be able to manage<br/>まかす【負かす】to defeat<br/>ふか【負荷】burden; load (e.g. cpu time, electricity, etc.)<br/>かおまけ【顔負け】feeling embarrassed; being put to shame; bowing to<br/>おわす【負わす】to impose; to visit upon; to inflict<br/>きおう【気負う】to get worked up; to be eager (enthusiastic); to rouse oneself<br/>ふさい【負債】debt; liabilities<br/>うけおい【請負】contract (for work); contracting; undertaking<br/>おいめ【負目】(feeling of) indebtedness; feeling obliged<br/>うけおう【請け負う】to contract; to undertake / to take over; to take responsibility for	4	フ	ま.ける, ま.かす, お.う	63	406	2	[sound:RTK1_keyword_jp_67.mp3]	[sound:RTK1_keyword_en_67.mp3]
68	"<img src=""E4B887.png"" />"	ten thousand			万	まん	ten thousand	ten thousand, one, ceiling, bound up	"Japanese counts higher numbers in units of <b>ten thousand</b>, unlike the West, which advances according to units of one thousand. (Thus, for instance, 40,000 would be read ""four <b>ten-thousands</b>"" by a Japanese.) Given that the comma is used in larger numbers to <i>bind up</i> a numerical unit of one thousand, the elements for <i>one</i> and <i>bound up</i> naturally come to form <b>ten thousand</b>. The order of strokes here needs special attention, both because it falls outside the general principles we have learned already, and because it involves writing the element for <i>bound up</i> in an order opposite to the one we learned. If it is any consolation, this exception is consistent every time these three strokes come together."		3	I bound ten thousand dollars together and hid it under the floor.	"We have ""one"" at the top and if you turn the kanji 90 degrees you will see arabic 4 shich means it has four zeros in front of it!"	万	"まん; よろず【万】10,000; ten thousand / myriad / everything; all / various<br/>ばん【万】many; all<br/>まんいち; ばんいち; まんいつ; ばんいつ【万一】emergency; unlikely event / by some chance; by some possibility<br/>ばんじ【万事】all; everything<br/>まんがいち; まんがいつ【万が一】if by any chance; just in case; in the worst case; in the unlikely event that; 10000 to 1<br/>ばんぜん【万全】perfection; flawlessness<br/>せんまん【千万】10,000,000; ten million; myriad<br/>せんばん; ちよろず【千万】exceedingly; very many; very much; indeed; a great many<br/>ばんのう; まんのう【万能】all-purpose; utility / almighty; omnipotent<br/>ばんぶつ; ばんもつ【万物】all things; all creation<br/>ばんり【万里】thousands of miles<br/>まんねんひつ; まんねんぴつ; まんねんふで【万年筆】fountain pen<br/>まんりき【万力】vise; jack; capstan<br/>ばんたん【万端】all; everything<br/>まんようがな【万葉仮名】early Japanese syllabary composed of Chinese characters used phonetically<br/>ばんこく【万国】all countries; the whole world; universal; all nations<br/>まんざい【万歳】door-to-door comedic duo<br/>ばんざい; ばんぜい【万才】crying ""banzai"" (or raising one's hands in the banzai gesture) / something worthy of celebration / giving up / long time / eternal life (and prosperity) / banzai (a celebratory cheer); hurrah (hooray, hurray)<br/>まんびき【万引】shoplifting; shoplifter<br/>まんじゅ【万寿】Manju era (1024.7.13-1028.7.25)"	4	マン, バン	よろず	64	227	4	[sound:RTK1_keyword_jp_68.mp3]	[sound:RTK1_keyword_en_68.mp3]
69	"<img src=""E58FA5.png"" />"	phrase			句	く	fraas	phrase, bound up, mouth	By combining the two primitives <i>bound up</i> and <i>mouth</i>, we can easily see how this character can get the meaning of a <b>phrase</b>. After all, a <b>phrase</b> is nothing more than a number of words <i>bound up</i> tightly and neatly so that they will fit in your <i>mouth</i>.		5	Some Japanese phrases are difficult to wrap your mouth around.	A bound mouth cannot utter a single phrase.	句	もんく【文句】complaint; grumbling; objection / phrase; words; expression<br/>く【句】section (i.e. of text); sentence; passage; paragraph / phrase / verse (of 5 or 7 mora in Japanese poetry; of 4, 5, or 7 characters in Chinese poetry) / haiku; first 17 morae of a renga, etc. / maxim; saying; idiom; expression<br/>ぜっく; ぜく【絶句】being lost for words; becoming speechless / jueju (Chinese quatrain with lines of either five or seven syllables)<br/>あげく【挙句】in the end (after a long process); finally; after all; at last / last line (of a renga)<br/>いっく【一句】phrase (verse, line) / one haiku-poem<br/>れんく【聯句】linked verse; couplet<br/>はいく【俳句】haiku; 17-mora poem, usu. in 3 lines of 5, 7 and 5 morae<br/>あげく【挙句】in the end (after a long process); finally; after all; at last / last line (of a renga)<br/>あげく【挙句】in the end (after a long process); finally; after all; at last / last line (of a renga)<br/>にのく【二の句】another word; answer<br/>せっく【節供】seasonal festival<br/>ほっく【発句】first 17-syllable verse of a renga / haiku / first five-syllable line of a tanka<br/>じょうとうく【常とう句】cliche / frequently used musical (guitar) phrase<br/>ごく【語句】words; phrases<br/>きんく【禁句】taboo word<br/>びじれいく【美辞麗句】flowery words; rhetorical flourishes<br/>けっく【結句】last line of a poem / finally<br/>しく【詩句】verse<br/>けいく【警句】aphorism<br/>ころしもんく【殺し文句】clincher; pick-up line; honeyed phrase; telling phrase; phrase that brings someone around, esp. in personal relationships	4	ク		65	683	1	[sound:RTK1_keyword_jp_69..mp3]	[sound:RTK1_keyword_en_69.mp3]
70	"<img src=""E8828C.png"" />"	texture			肌	はだ	texture	texture, moon, month, flesh, part of the body, wind	"Ever notice how the <b>texture</b> of your face and hands is affected by the <i>wind</i>? A day´s skiing or sailing makes them rough and dry, and in need of a good soft cream to soothe the burn. So whenever a <i>part of the body</i> gets exposed to the <i>wind</i>, its <b>texture</b> is affected. (If it is any help, the Latin word hiding inside <b>texture</b> connotes how something is ""to the touch."")"		6	When you expose your flesh to the wind it gets textured: goosebumps!	The moon´s lack of wind preserves its texture.	肌	はだ; はだえ【肌】skin / body (in the context of intimate bodily contact) / surface; grain (e.g. of wood); texture / disposition; temperament; character; type<br/>とりはだ【鳥肌】gooseflesh; goose pimples; goose bumps<br/>すはだ【素肌】bare (naked) body; complexion (e.g. face)<br/>いわはだ【岩肌】bare rock; rock surface; rock face<br/>やまはだ【山肌】mountain's surface; bare surface of a mountain<br/>はださむい; はだざむい【肌寒い】chilly; unpleasantly cold<br/>はだみ【肌身】body<br/>やわはだ【柔肌】soft fair skin<br/>はだいろ【肌色】flesh-coloured; flesh-colored; skin-coloured; skin-colored<br/>じはだ【地肌】texture; grain / one's skin (lacking makeup, etc.); natural skin; bare skin; scalp / surface of the earth; bare ground / surface of a sword blade<br/>はだぎ; はだぎぬ【肌着】underwear; underclothes; lingerie; chemise; singlet<br/>きめ【肌理】grain; (skin) texture<br/>はだざわり【肌ざわり】the touch of; feel of; texture<br/>ひとはだ【人肌】the skin; human skin / body warmth<br/>びはだ【美肌】beautiful skin<br/>きはだ【木肌】bark of a tree<br/>もちはだ【もち肌】soft skin; smooth skin<br/>ひとはだぬぐ【一肌脱ぐ】to pitch in and help<br/>かたはだ【片肌】bare shoulder<br/>ひとはだ【人肌】the skin; human skin / body warmth	4	キ	はだ	66	1098	2	[sound:RTK1_keyword_jp_70.mp3]	[sound:RTK1_keyword_en_70.mp3]
